category,temizlenmis_title,temizlenmis_description,source
other,yalıkavaktaki azeri mutfağı,bodrumda sezonu açtım yalıkavakın yenilerinden sumakha uğradım biraz marinada turladım sezon başında gündem olan milyon bin liralık hesabın ödendiği bagatelleye sızdım neler oluyor diye bakındım,Hurriyet.com.tr
sports,tffden arda güler montella açıklaması antrenmandaki görüntü konuşulmuştu,türkiye futbol federasyonu çekya maçı hazırlıkları sırasında teknik direktör montella arda gülerin arasında geçen sosyal medyada gündem olan görüntüler sonrası açıklama yaptı,Hurriyet.com.tr
other,yüzyıllardır yapıyoruz yeniden gündem oldu yere sırtüstü yatıp uzanmak iyi geliyor,kaçınız gün içerisinde yere uzanıp dakikalığına dış dünya bağını koparıyor en son çıplak ayakla çimlere zaman bastınız aslında insanoğlu yüzyıllardır yapıyor artık doğadan uzaklaştık toprakla etkileşime geçemiyor gün,Hurriyet.com.tr
entertainment,paylaşım gündem,hafta en konuşulan paylaşımlar demet şener yasemin şefkatli mahsun kırmızıgülden geldi kimi paylaşımın yanlış anlaşılmasıyla kimi olumsuz yoruma verdiği karşılıkla kimi jön çıkışıyla gündem oldu detaylar panoramada,Haberturk.com
sports,fenerbahçeden gündem çağlar söyüncü,fenerbahçe çağlar söyüncüyü kadrosuna katmak için girişimlerini sürdürüyor sarı lacivertlilerin transfere kısa süre içinde resmiyet kazandırması bekleniyor,Haberturk.com
entertainment,haftanın gündem olan paylaşımları,haftanın en konuşulan paylaşımları ibrahim tatlısesin kızı dilan çıtak wanda naradan geldi çıtak sonradan vazgeçtiği şikâyet silsilesiyle nara ise galatasarayın yıldız futbolcusu mauro icardiden ayrıldığını açıklamasıyla gündeme geldi detay,Haberturk.com
other,simpsonlar yine gündem oldu,abd başkanı trumpa yönelik suikast girişiminin ardından simpsonlar dizisi yine gündem oldu dizinin bölümü sosyal medyada suikast girişimi ilişkilendirildi paylaşımı yapılan karenin kaynağının farklı olduğu belirlendi,Haberturk.com
sports,görüntüler gündem oldu,tff başkanı mehmet büyükekşi euro çeyrek finalinde hollanda karşılaşacak milli takım oyuncularını leipzigden berline uğurlarken cenk tosunun tavrı olay oldu cenkin otel çıkışında futbolcularla tek tek tokalaşan büyükekşinin arkasından geçi,Haberturk.com
politics,tbmmde tatil sonrası yoğun gündem,tbmm genel kurulu günlük kurban bayramı tatilinin ardından haftalık çalışmasına haziran salı günü başlayacak genel kurulda kripto varlıklara ilişkin düzenlemeler içeren kanun teklifinin görüşmelerine başlanacak dijital telif gündemiyle toplanacak,Haberturk.com
sports,mertin kurtarışı dünyada gündem oldu,milli takımımız euro son turunda avusturyayı yenerek çeyrek finale yükselirken mert günokun te yaptığı müthiş kurtarış maça damgasını vurdu tecrübeli file bekçisi baumgartnerin yerden seken kafa vuruşunu harika refleksle kornere ç,Haberturk.com
entertainment,ilayda alişan oğulcan engin tatilde gelsene aşkım,ilayda alişan oğulcan engin bayram tatilini geçirmek için çeşmeyi tercih etti,Hurriyet.com.tr
other,bozcaadaya girişçıkış ücreti yeniden gündem oldu,yaz aylarında tatilcilerin akınına uğrayan bozcaadada belediye adada ikamet etmeyenlerden çevre trafik düzenlemesi katkı ücreti alıyor yıl tl olan ücret sosyal medyada tartışılırken artan su tüketimi ada sakinlerinin olumsuz etkilenen günlü,Haberturk.com
politics,ak parti myk toplantısında gündem,ak parti merkez yürütme kurulu myk yarın cumhurbaşkanı recep tayyip erdoğan başkanlığında toplanıyor toplantıda siyasetteki normalleşme tartışmaları yeni anayasa hazırlık sürecinin yanı sıra vergide reform paketi gündeme gelecek erdoğan toplantı so,Haberturk.com
other,sosyal medyada gündem olmuştu istanbuldaki tepki çeken tabelalar kaldırıldı,sadrazam mehmet paşa tarafından lü yılların başında inşa edilen çeşme namazgah yıllar içinde kaderine terk edildi tarihi yapının altında alüminyum doğrama oto lastik dükkanı açıldı çevredekilerin sosyal medyadaki tepkileri üzerine harekete geç,Hurriyet.com.tr
sports,barış alper yılmaz paylaşımı gündem olmuştu bakanlıktan murat gevrek açıklaması,gençlik spor bakanlığı dün akşam milli futbolcu barış alper yılmaz hakkında paylaşımda bulunan murat gevrekin hatay gençlik spor il müdürlüğü görevinin önce sona erdiğini belirtti,Hurriyet.com.tr
politics,erdoğan bugün abdye gidiyor natoda liderlerle sıcak gündem,cumhurbaşkanı erdoğan nato zirvesinde ittifak liderleriyle araya gelirken gazzeden ukrayna savaşına karadenizin güvenliğinden terörle mücadeleye türkiyenin durduğu yeri kez vurgulayacak,Hurriyet.com.tr
entertainment,dilan çıtak konuşacağım dedi sessizliğe büründü,dilan çıtak tatlıses kız çocuğuna yapılan şiddeti herkes bilmeli paylaşımının ardından sessizliğe büründü bodrumda görüntülenen şarkıcı kısa sürede sildiği paylaşımıyla ilgili soruları konuşulacak yok diyerek yanıtsız bıraktı,Hurriyet.com.tr
politics,orban türkiye rusyaukrayna savaşında başarıyla arabuluculuk yapan tek ülke,macaristan başbakanı viktor orban nato zirvesinde cumhurbaşkanı recep tayyip erdoğanla görüşmesine dair yaptığı açıklamada türkiye rusyaukrayna savaşında taraflar arasında başarıyla arabuluculuk yapan tek ülkedir dedi orban ukrayna barış misyonunda e,Hurriyet.com.tr
other,istanbulda sokak ortasında develer görüldü,sosyal medyada yayılan video izleyenleri şaşırttı istanbulda sokak ortasında gezen deve gündem oldu,Haberturk.com
politics,kabine bugün toplanıyor emekli ek zammı masada,kabine bugün cumhurbaşkanı recep tayyip erdoğan başkanlığında cumhurbaşkanlığı külliyesinde toplanıyor kabinede konu masaya yatırılacak en önemli gündem konusu emekli ek zammı olacak kabinenin ardından milyonlarca emekliyi ilgilendiren ek zam,Haberturk.com
politics,kabine kararları sonuçları,kabine bugün cumhurbaşkanı recep tayyip erdoğan başkanlığında cumhurbaşkanlığı külliyesinde toplanıyor kabinede konu masaya yatırılacak en önemli gündem konusu emekli ek zammı olacak kabinenin ardından milyonlarca emekliyi ilgilendiren ek zam,Haberturk.com
sports,beşiktaşta sağlık kontrolleri devam ediyor,beşiktaşta takımdan ayrılması gündem olan futbolcular vincent aboubakar arthur masuaku omar colley kulübün sponsor hastanesinde sağlık kontrolünden geçti,Haberturk.com
entertainment,uraz erkek rol arkadaşıyla öpüştü,uraz kaygılaroğlu aşık shakespeare adlı tiyatro oyununun provalarında erkek rol arkadaşıyla öpüştü anlar sosyal medyada gündem oldu,Haberturk.com
entertainment,kadir inanırdan haber var,kadir inanırın sağlık durumunun iyiye gitmediği hatta entübe edildiği öne sürüldü hayat arkadaşı jülide kural iddiaları yalanladı akciğerinde görülen enfeksiyon nedeniyle gündür tedbir amaçlı yoğun bakımda entübelik durum yok hatta kadir bey günd,Hurriyet.com.tr
politics,bidenı beklerken gözlerini devirdi,italya başbakanı giorgia meloninin nato zirvesinde liderlerle birlikte abd başkanı joe bidenı beklerken gözlerini devirmesi sosyal medyada dünya çapında gündem oldu,Haberturk.com
politics,kabine toplanıyor masadaki konular,kabine bugün saat cumhurbaşkanı recep tayyip erdoğan başkanlığında cumhurbaşkanlığı külliyesinde toplanıyor masadaki en önemli gündem maddesi emekli maaşları olacak,Haberturk.com
politics,vergi paketine uzman gözü,ak parti myk dün cumhurbaşkanı tayyip erdoğan başkanlığında toplanırken gündemde vergi paketi vardı ak parti sözcüsü çelik tartışılan yurtdışı harcının gündem olduğunu henüz son kararın verilmediğini belirterek vergide adalet hedeflenirken uzman,Hurriyet.com.tr
politics,savcı kristin cezaevi koşulları gayet uygun porscheli yaşamdan sonra zordur,eylem tok oğlu timur cihantimurun davaları abdde sürerken amerikalı savcı gündem oldu avukatları timur cihantimurun kaldığı ıslahevinin koşullarından şikâyet edince savcı kristin kearney annesinin porschesiyle dolaşan çocuk için koşullar elbet,Hurriyet.com.tr
economics,cumhurbaşkanlığı kabinesi bugün toplanıyor toplantının ana gündemi ekonomi,cumhurbaşkanlığı kabine toplantısı ay aranın ardından bugün cumhurbaşkanı erdoğanın başkanlığında yapılacak toplantıdaki ana gündem maddesi yarın açıklanacak enflasyon rakamları olacak toplantıda tasarruf tedbirleri en düşük emekli aylığına yapılacak,Hurriyet.com.tr
entertainment,serbest bırakıldı,justin timberlake alkollü araç kullanırken polise yakalanmasının ardından gözaltına alınmış sabıka fotoğrafları gündem olmuştu ünlü şarkıcı mahkemeye çıktıktan sonra serbest bırakıldı,Haberturk.com
politics,kabine toplantısı tarihi,yeni haftanın gelişiyle birlikte yeni kabine toplantısının tarihi gündemi meşgul etmeye başladı gündeme dair pek konunun ele alındığı kabine toplantısında kabine kararları toplantının sona ermesinin ardından cumhurbaşkanı erdoğan tarafından açıklanma,Haberturk.com
politics,paris belediye başkanı sözünü tuttu sen nehrinde yüzdü,paris belediye başkanı hidalgo olimpiyatların yapılacağı kirliliği gündem olan sen nehrinde yüzdü hidalgo ten yana yüzmenin yasak olduğu nehrin temiz olimpiyatlara hazır olduğunu kanıtlamak için verdiği sözü tuttu nehirde yüzdü,Haberturk.com
other,ankaranın simgesi kuğulu parktaki tel örgüler gündem olmuştu nedeni belli oldu,ankaranın simgelerinden kuğulu parkta iki kuğu arasına çekilen tel örgü sosyal medyada gündem oldu tel örgünün iki farklı tarafında olmalarına rağmen sürekli karşı karşıya gelen kuğular parka gelen ziyaretçilerin dikkatini çekti bazı ziyaretçiler kuğular,Haberturk.com
entertainment,azem isminin anlamı nedir,bilhassa inci taneleri dizisiyle iyice gündem olan anlamı üzerine araştırma yapılan azem ismi yeni bebek heyecanı yaşayan kişiler tarafından merak ediliyor dikkat çekici duyulmayan erkek isimlerinden olan azem detaylar aşağıda,Haberturk.com
politics,meloninin nato zirvesinde bidenı beklerken gözlerini devirmesi gündem oldu,italya başbakanı giorgia meloninin nato zirvesinde liderlerle birlikte abd başkanı joe bidenı beklerken gözlerini devirmesi sosyal medyada dünya çapında gündem oldu anadolu ajansı,Anadolu Agency
technology,türkiyedeki oyun fiyatları dünya çapında gündem oldu,içerik ilk olarak türkiyedeki oyun fiyatları dünya çapında gündem oldu adresinde yayınlandı teknoloji haberleri shiftdeletenet,Shiftdelete.net
politics,avrupada gündem felaket senaryoları,avrupada gündem fransa seçimleri başta olmak üzere aşırı sağ partilerin tek tek iktidara yürümesi batı medyasının manşetlerinde günlerdir felaket senaryoları konuşuluyor fransada pazar günü gerçekleştirilendevamı için tıklayınız,Sabah.com.tr
other,aha dayıya sor sözleriyle gündem olmuştu cezaevinden izinli çıkan gaspçı hüseyin sahtesine dava açıyor dolandırıcı,adanada gerçekleştirdiği gasp sonrasında kere hacca gidip geldim aha dayıya sor diyerek sosyal medyada ünlenen hüseyin taşkıran tane çocuk çıkmış benim üzerimden prim kasıyor hacca gitmiş benim fotoğraflarım kendi fotoğraflarını birleştirer,Hurriyet.com.tr
politics,diplomasi trafiğinde temmuz maratonu,cumhurbaşkanı erdoğanı bayram sonrası yoğun diplomasi trafiği bekliyor temmuzda astanada temmuzda azerbaycanda olacak erdoğan temmuzda ise nato zirvesi için abdyi ziyaret edecek ardından chp lideri özeli davet ettiği kktcdeki,Hurriyet.com.tr
other,dua eden transformers gündem oldu,optimus prime bumblebee kocaelide mevlütte fatiha okurken görüntülendi,Odatv.com
entertainment,modern sanat etkinliği gündem oldu,modern sanat etkinliğinde kaydedilen sosyal medyada yayılan görüntüler kullanıcıların tepkisini çekti,Odatv.com
entertainment,can yamanın dansı gündem oldu,kariyerine italyada devam eden can yamanın dans eğitmeni sevgilisi mariagiulia venanzi performansı sosyal medyada gündem oldu,Odatv.com
politics,meclis tatile girdi mi,türkiye büyük millet meclisi tbmm arasının zaman başlayacağı merak konusu oldu meclis geçen sene çalışmalarının tamamlaması bazı kanun kanun hükmünde kararnamelerde değişiklik yapılmasına dair kanun teklifi görüşmelerinin sona ermesinin ardından ç,Haberturk.com
entertainment,rebel wilson bodrumda tatil yapıyor,hollywood filmleriyle adını duyuran rebel wilson arkadaşlarıyla birlikte bodrumda tatil yapıyor,Haberturk.com
politics,kabine toplantısı zaman,cumhurbaşkanı erdoğan liderliğinde toplanan kabine toplantısı için geri sayım sürüyor ülkenin gündemine dair önemli kararların alındığı yeni kabine toplantısında yargı paketi gazzedeki son gelişmeler emekli memur maaşlarına ilişkin konuların yer,Haberturk.com
economics,engelli bireylerin ötv istisnası kalkıyor,son günlerde türkiyenin yeni ana gündem maddelerinden vergi paketi oldu vergi adaletsizliğini bitirmek kazanandan kazanandan vergi almak amacıyla hayata geçirilmeye çalışılan vergi paketinde engelli bireylere araba alımında uygulan,Haberturk.com
economics,asgari ücrete ara zam var mı,ekonominin gündem konularından olan asgari ücret zammı hakkında son gelişmeler merak ediliyor emekli memur zammının netleşmesinden sonra gözler asgari ücrete döndü hükümet tarafından yapılan açıklamalar sene zammın olmayacağını işaret,Haberturk.com
technology,bydnin milyar dolarlık türkiye yatırımı dünya basınında gündem oldu,içerik ilk olarak bydnin milyar dolarlık türkiye yatırımı dünya basınında gündem oldu adresinde yayınlandı teknoloji haberleri shiftdeletenet,Shiftdelete.net
politics,kabine toplantısı kararları bekleniyor,bayram sonrası ilk kez cumhurbaşkanı erdoğan liderliğinde kabine toplantısı gerçekleşecek hafta yapılması beklenen yeni kabine toplantısı tarihi belli oldu murat kurum kemal memişoğlu ise ilk kez toplantıya katılacak toplantının ana gündem maddesi em,Haberturk.com
entertainment,hülya avşarın dansı gündem oldu,hülya avşar önce evinin bahçesindeki havuzda yüzdü sonra komşu çocukları eğlendi havuz başında dans etti,Odatv.com
other,üç kişilik evlenme teklifi gündem oldu,iki kadına birden evlenme teklifi eden adamın toplu evet aldığı video gündem oldu,Odatv.com
entertainment,bin tllik kabe sorusu gündem oldu,kim milyoner olmak isterde dokuzuncu soruya gelen yarışmacıya kabe tam olarak güneyinizde kalıyorsa hangi il sınırları içerisinde olabilirsiniz diye soruldu yiğit ata cankoy isimli genç kazandığı para ödülüyle yarışmadan çekildi,Odatv.com
politics,kabine toplantısı kararları açıklandı,bayram sonrası ilk kez cumhurbaşkanı erdoğan liderliğinde kabine toplantısı gerçekleşti kapsamda murat kurum kemal memişoğlu ise ilk kez toplantıya katıldı toplantının ana gündem maddeleri gündemdeki yerini aldı peki temmuz kabine toplantısı kara,Haberturk.com
politics,trumpın fotoğrafı tişörtlere basıldı,eski abd başkanı trumpa seçim mitinginde düzenlenen silahlı saldırı dünya gündemine otururken trumpın saldırıdan hemen sonra sağ yumruğunu gökyüzüne kaldırdığı anlarda çekilen fotoğraf gündem oldu dünyanın dört yanında gazete manşetlerinde yer alan,Haberturk.com
politics,cumhurbaşkanı erdoğan nato zirvesine katılacak,cumhurbaşkanı erdoğan washingtonda bugün başlayan temmuzda sonra erecek nato zirvesine katılacak yaşını kutlamaya hazırlanan natonun yılki zirve gündeminde rusyaukrayna savaşı ana gündem maddesi olacak cumhurbaşkanı erdoğan zirve kapsam,Haberturk.com
politics,stoltenberg washington zirvesindeki en acil görevimiz ukraynaya destek olacak,nato genel sekreteri jens stoltenberg washingtondaki nato zirvesinin en önemli gündem maddesinin müttefiklerin ukraynanın en acil ihtiyaçları ülkeye uzun vadeli destek için anlaşmaları olacağını söyledi anadolu ajansı,Anadolu Agency
politics,dünyanın iki farklı gündemi,euro israilin saldırılarının sürdüğü gazzedeki yıkım insani kriz son dönemde dünya gündeminde yer alan iki önemli konu başlığı oldu iki önemli gündem maddesinden yansıyan bazı fotoğraflar arasında ise benzerlikler göze çarpıyor,Anadolu Agency
other,istiklal marşı okuyan japonlar gündem oldu,önce müslüman olması haberlere konu olan japon uyruklu masataka kobayashi kez yeğeni birlikte istiklal marşını okudu,Odatv.com
entertainment,yalı çapkınının yeni yıldızı pozlarıyla gündem oldu,yalı çapkınına serpil karakteriyle katılacak olan oyuncu türkü su demirel paylaşımıyla gündemde,Odatv.com
politics,bakan şimşekten makam aracıyla ilgili iddialara yanıt,bakan şimşek bilinçli şekilde suni gündem oluşturulmak istendiğini belirterek buna karşı biz makrofinansal istikrarı tesis etmek sürdürülebilir yüksek büyümeye ulaşmak için uygulamaya koyduğumuz programımıza kararlılıkla devam edeceğiz dedi anadolu,Anadolu Agency
sports,montella arda arasındaki görüntü gündem oldu,milli futbol takımının italyan teknik direktörü vincenzo montellanın çekya maçının antrenmanında arda gülerin elinden yeleği çekip alması tepki çekti,Haber7.com
politics,chp lideri özelden açıklamalar,chp lideri özgür özel partisinin grup toplantısında açıklamalarda bulunuyor,Haberturk.com
sports,zil zurna sarhoş olan balotelli gündem oldu,son olarak süper lig ekibi adana demirsporda forma giyen şu anda kulüpsüz olan mario balotellinin italyada görüntüleri olay oldu,Haber7.com
sports,mert günok merihin konuşması gündem oldu,milli takım alecisi mert günokun yaptığı kurtarış ayyıldızlı oyuncularımızı şaşkına çevirdi merih demiral takım arkadaşının yanına gitti aralarında geçen konuşma,Haber7.com
other,üç dakikada nato zirvesi barış yok savaş var,bakmayin siz kuruluş yıldönümü nedeniyle azıcık festival havasında geçmesine,Hurriyet.com.tr
sports,nikeın suudi arabistan reklamı gündem oldu,ünlü spor giyim markası nike yeni reklamında suudi arabistandaki kadınların sosyal hayattaki değişim mücadelelerini konu aldı,Odatv.com
sports,hüseyin yücelden di maria açıklaması,beşiktaş ikinci başkanı hüseyin yücel angel di maria transferi için çarpıcı açıklamalarda bulundu,Haberturk.com
other,avustralyada polisin gözaltındaki yerli halk mensubu çocuğa sert muamelesi gündem oldu,avustralyada polisin gözaltına alınan first nations ilk halklar yerli halkına mensup çocuğa sert müdahalesine ilişkin görüntüler tepki çekti anadolu ajansı,Anadolu Agency
economics,hepsiburada nasdaq üst yöneticisini ağırladı,hepsiburada nasdaq küresel listeleme başkanı karen snowu ağırladı ceo nilhan onal gökçetekinin ev sahipliğinde gerçekleşen ziyarette nasdaq hepsiburada arasındaki iş birliği fırsatları değerlendirildiği belirtildi,Haberturk.com
other,camiden sabun çalan adam gündem oldu,caminin tuvaletini kullanan kişi sabunluğu kıyafetinin altına saklayarak çaldı camiden hızla çıkan şahıs lüks aracına binerek uzaklaştı,Odatv.com
politics,imamoğlu bakanla görüştü sosyal medyada gündem oldu,ibb başkanı ekrem imamoğlu berlinde almanya dışişleri bakanı annalena baerbock görüştü,Odatv.com
sports,şırnak uludere spor kulübünün stadı gündem oldu,şırnak uludere spor kulübünün stadyumu havadan görüntülendi eşsiz manzarası dikkat çeken stat sosyal medyada gündem oldu,Odatv.com
entertainment,oryantal solmazın son dansı gündem oldu,seda sayan uğur arslanın sunduğu evleneceksen gel adlı evlilik programıyla tanınan solmaz çiros dansları güzelliğiyle dikkat çekmişti solmaz son dansı sosyal medyada gündem oldu,Odatv.com
other,gelin damadın düğündeki mutsuzluğu gündem oldu,sosyal medyada yayılan düğün videosunda gelin damadın yüzündeki mutsuzluk büyük yankı uyandırdı,Odatv.com
entertainment,ateşe düştüm pişmanlığı,ebru yaşar kaçırdığı şarkılardan yaşadığı pişmanlıkları açıkladı yaşar mert demirin ateşe düştüm adlı şarkıyı seslendirmeden önce ilk olarak kendisine gönderdiğini söyledi,Haberturk.com
sports,fransa arjantini fifaya şikayet edecek,copa america sonrası şampiyonluk sevinci yaşayan arjantin milli takımı otobüste fransa milli takımına karşı tezahüratta bulundu arjantinliler anneleri nijeryalı babaları kamerunlu pasaportlarında fransa yazıyor ifadelerini kullandı hareket sonr,Haberturk.com
entertainment,ibrahim tatlısesin oxford sözleri gündem oldu,ibrahim tatlısesin torunu berfin karakeçilinin ofxord üniversitesine reklamcılık alanında başvurduğu öğrenildi akıllara tatlısesin meşhur sözü geldi,Odatv.com
sports,milli takımın yıldızı küçüklük fotoğrafı gündem oldu,galatasarayın milli takımımızın yıldız futbolcusu barış alper yılmazın çocukluk fotoğrafı sosyal medyanın gündemine oturdu,Odatv.com
other,en mutsuz düğün sosyal medyada gündem oldu,son günlerde sosyal medyada paylaşılan düğün fotoğrafları görenleri hayrete düşürdü mutluluğun sevincin dorukta olması beklenen düğün töreninde gelin damadın mutsuz halleri dikkat çekti,Odatv.com
politics,izmirdeki skandal sonrası skeç gündem oldu,izmirde yoldaki elektrik kaçağı nedeniyle iki vatandaşın hayatını kaybettiği skandal sonrası levent kırcanın yıllar önceki skeci yeniden gündem oldu,Odatv.com
politics,nato zirvesinin kadın liderleri,günlerdir dünyanın gözü washingtonda gerçekleşen nato liderler zirvesinde zirvenin ana gündem maddesi ise ukraynaya destek çin tehdidi oldu zirve sonunda kadın barış güvenlik politikasının güncellenmiş hali onaylandı bildirgeye üye,Haberturk.com
politics,türkiyeab yüksek düzeyli diyaloğunun ilk toplantısı yarın,türkiye avrupa birliği arasındaki yüksek düzeyli ticaret diyaloğunun ilk toplantısı ticaret bakanı ömer bolat avrupa komisyonu başkan yardımcısı valdis dombrovskis başkanlığında yarın brükselde yapılacak,Haberturk.com
politics,ukraynaya destek natoyu çatışmaya taraf yapmayacak,nato genel sekreteri jens stoltenberg ukraynaya askeri desteğe ilişkin natoyu çatışmanın tarafı haline getirmeyecek ukraynanın kendini savunma hakkını korumasına yardımcı olacak dedi,Haberturk.com
other,irfan değirmenci ben lgbti kimliğimle barışığım,gazeteci irfan değirmencinin merih demiralı eleştirdiği videonun bölümü kesilerek sosyal medyada eleştirilmesi gündem oldu,Odatv.com
other,gelinin inanılmaz değişimi,manisada geline yapılan makyaj gelinin değişimi sosyal medyada gündem oldu,Odatv.com
entertainment,hadise aynı kıyafeti ikinci kez giyince gündem oldu,hadise sahnesinde tasarrufa gitti güzel popçu önce giydiği kıyafetle sahneye çıktı ünlü şarkıcıya cimri hadise yorumları beraberinde geldi,Odatv.com
entertainment,netflixin tiktok tarikatı belgeseli gündem oldu şeytanın dansçılarında anlatılıyor,dansçı miranda derrick netflix belgeseli şeytanın dansçıları m adında tiktok tarikatının yayınlanmasının ardından ölüm tehditleri aldığını öne sürdü milyon kişi tarafından izlenen belgesel gündem oldu,Odatv.com
economics,asgari ücrete zam var mı,milyonlarca vatandaş temmuz ayına girmemize günler kala asgari ücret hakkında son gelişmeleri merak ediyor asgari ücrete ara zam olup olmayacağına dair arka arkaya gelen açıklamalarda tablo netleşirken yandan tüik tarafından temmuzda açıklanacak e,Haberturk.com
politics,cumhurbaşkanı erdoğandan yoğun diplomasi trafiği,cumhurbaşkanı erdoğan temmuz ayında kritik diplomasi trafiği yürütecek ilk olarak şanghay işbirliği örgütü liderler zirvesine katılacak olan erdoğan sonra nato liderler zirvesine katılacak,Haberturk.com
politics,murat kurum bakan olunca sözler gündem oldu,murat kurumun çevre şehircilik iklim değişikliği bakanlığına atanması sonrası ibb başkanı ekrem imamoğlunun ben ona bakan olamazsın demedim köfteci olamazsın dedim sözleri yeniden gündem oldu,Odatv.com
politics,chpli meclis üyesi darp edilip vuruldu durumu ağır,kayseri pınarbaşı belediye meclis üyesi şerafettin bahadır kimliği belirsiz kişiler tarafından önce darp edildi ardından silahla vuruldu durumu ağır olan bahadır tedavi altına alındı saldırganlar aranıyor,Haberturk.com
economics,bakan işıkhan açıkladı asgari ücret,asgari ücret tartışmaları gündemdeki yerini korumaya devam ediyor son olarak haziranda gazetecilerin sorularını yanıtlayan çalışma sosyal güvenlik bakanı vedat işıkhan amaçlarının geçici ekonomik refahı sağlamak olmadığını söyledi peki asgari üc,Haberturk.com
other,istanbulda sokak ortasında otlanan develer,sosyal medyada yayılan video izleyenleri şaşırttı istanbulda sokak ortasında otlanan deve gündem oldu,Odatv.com
politics,erdoğanın temmuz diplomasisi,cumhurbaşkanı erdoğan temmuz ayında yoğun diplomasi trafiği yürütecek şanghay işbirliği örgütü şiö zirvesi için kazakistanda bulunan erdoğan sonra türk devletleri teşkilatı tdt gayriresmi zirvesi için azerbaycana gelecek hafta ise nato zirv,Hurriyet.com.tr
