category,temizlenmis_title,temizlenmis_description,source
entertainment,sultan köseni gören internet fenomeni hiko babanın tepkisi gündem oldu,sultan köseni karşısında gören hiko babanın yaşadığı şaşkınlık görenleri gülümsetti,Odatv.com
entertainment,esin gündoğdu verdiği kilolarla gündemde eğlenceli paylaşımı ise gündem oldu,ekranların sevilen komedi oyuncusu esin gündoğdu geçtiğimiz yıllarda sağlıklı beslenme sayesinde ameliyat olmadan yılda kilo vererek büyük dönüşüm yaşadı,Odatv.com
entertainment,lerin ünlü ismiydi ayşe mineden üzen haber,li yıllarda seslendirdiği erkek milleti yemin mi ettin şarkılarıyla ünlenen ayşe mineden üzen haber geldi,Hurriyet.com.tr
entertainment,akşam konser sabah ameliyat ibrahim tatlısesten haber var,harbiyede sahneye çıkan ibrahim tatlıses ertesi gün kalp ameliyatı oldu konserinde dinleyicilerinden gözyaşları içinde helallik isteyen sanatçının sağlık durumunun iyi olduğu öğrenildi davalık olduğu oğlu ahmet tatlıses konserde hastanede ibrah,Hurriyet.com.tr
sports,fenerbahçeye youssef ennesyriden beklenmedik haber telefon görüşmesi ortaya çıktı,adı fenerbahçe anılan sevillanın faslı golcüsü youssef ennesyri için romanın sürpriz atak yaptığı yeni gelişmeler yaşandığı ileri sürüldü,Hurriyet.com.tr
entertainment,diziyle hafızalara kazınmıştı ünlü oyuncudan acı haber geldi,kamera karşısına geçtiği beverly hills adlı diziyle genç yaşında hafızalara kazınan shannen doherty yılından yana hastalığına karşı verdiği mücadeleyi kaybetti,Hurriyet.com.tr
other,seçil erzana kötü haber,seçil erzanın şikâyeti üzerine denizbank yöneticileri hakkında başlatılan kişiyi hürriyetinden yoksun bırakma suçlamasına ilişkin soruşturmada takipsizlik kararı verildi savcılık erzanın iddialarının gerçeği yansıtmadığını suçların işlendiğine dair i,Hurriyet.com.tr
entertainment,acı haber,akın akınözünün kendisi gibi oyuncu olan annesi özlem akınözü uzun süredir mücadele ettiği hastalığa yenilerek hayatını kaybetti,Haberturk.com
entertainment,sürpriz teklifin perde arkasını anlattı kafamda hayal ettiğim gibi olmadı,camdaki kız dizisiyle tanınan feyyaz şerifoğlu italyanın capri adasında evlenme teklifi ettiği sevgilisi kanal d haber spikeri merve dinçkol önceki gün istanbul havalimanında görüntülendi,Hurriyet.com.tr
other,öğretmenlere iyi haber,milli eğitim bakanı yusuf tekinden öğretmene güzel haber geldi yıl öğretmenler için ikinci kez gerçekleştirecekleri il içi iller arası isteğe bağlı yer değiştirme başvurularının temmuzda başlayacağını bildiren bakan tekin öğretmenler odası buluş,Haberturk.com
other,emekli öğretmenden acı haber,balıkesirin erdek ilçesinde babası birlikte denizde yüzerken kaybolan yaşındaki emekli öğretmen banu şafak tutarın gün sonra kilometre uzaklıktaki bandırma ilçesine bağlı edincik altı sahilinde cansız bedeni bulundu iddiaya göre tutarın yüzer,Haberturk.com
other,trt haber haber koordinatörü görmez abu haber grubu başkanı seçildi,trt haber haber koordinatörü ahmet görmez asya pasifik yayın birliği abu haber grubu başkanı seçildi anadolu ajansı,Anadolu Agency
technology,facebook haber içeriğini engelleyecek,meta lisans ücreti ödememek için avustralyalılara haber içeriği paylaşmayı engellemeyi gündeme getirdiğini açıkladı facebookun sahibi metanın yaptığı açıklamaya hükümetin nasıl karşılık vereceği merakla bekleniyor,Haberturk.com
sports,david alabadan kötü haber,ispanyol devi real madridde top koşturan avusturyalı yıldız david alabadan kötü haber geldi detaylar,Haberturk.com
sports,lionel messiden kötü haber,copa americada kez şampiyonluğa ulaşan arjantin milli takımının dünyaca ünlü yıldızı lionel messi kolombiya oynadıkları final maçında sakatlanması nedeniyle oyuna devam edememişti,Haberturk.com
other,orman müdürü şehit oldu bergamadan acı haber,izmir bergamanın çobanlar mahallesindeki ormanlık alanda çıkan yangın saat sonra kontrol altına alınırken acı haber geldi kamyonetle yangın bölgesine gitmeye çalışan bergama orman işletme müdürü şahin dönertaş geçirdiği kaza sonucu şehit oldu ulaş,Hurriyet.com.tr
other,yaşındaki çocuktan acı haber,mersinin tarsus ilçesinde sulama kanalında akıntıyla sürüklenen vatandaşlarca sudan çıkartılan yaşındaki cumali eren dalkıran kaldırıldığı hastanede hayatını kaybetti,Haberturk.com
other,yaşındaki aselnurdan acı haber,siirtte balkonda oyun oynayan yaşındaki aselnur çengel dengesini yitirince kattan düşerek yaşamını yitirdi,Haberturk.com
other,bunaltan sıcaklarla ilgili kötü haber,son dakika hava durumu bunaltan sıcaklarla ilgili meteorolojiden yeni açıklama geldi buna göre marmara bölgesinde sıcaklıkların mevsim normallerinin derece üzerinde seyredeceği kaydedildi,Haberturk.com
other,açık kapı faciasında acı haber,edirnede sürücüsünün seyir halindeyken kapısını açtığı minibüsten düşen yaşındaki ufuk çelik gün sonra hayatını kaybetti,Haberturk.com
other,aras nehrinde kaybolan çocuktan acı haber,erzurumda dün aras nehrinde kaybolan yaşındaki vefa murat sevukun cansız bedenine ulaşılmıştı ekipler sabah yaşındaki yusuf özerin cansız bedenini buldu,Hurriyet.com.tr
other,yaşındaki gençten acı haber,muğlanın fethiye ilçesine tatile gelen yaşındaki genç boğularak hayatını kaybetti,Haberturk.com
sports,milli takıma kötü haber,milli takımda portekiz maçında sarı kart gören abdülkerim bardakcı çekya maçında cezalı duruma düştü,Haberturk.com
entertainment,kullandığı tacı bile başkasına verdiler acaba an bile üzülmedi mi,ingiliz kraliyet ailesi yılın başlarından beri gerçekten zor günler yaşıyor önce kral charles ardından büyük oğlu prens williamın karısı galler prensesi kate kanser tedavisi göreceklerini açıkladı haber dünyayı kelimenin tam anlamıyla şoke etti,Hurriyet.com.tr
other,baraja düşen araçtaki çocuktan acı haber,bilecikin pazaryeri ilçesinde el freninin boşalması sonucu baraja düşen otomobildeki yaşındaki çocuk hayatını kaybetti,Haberturk.com
technology,türksat adan yeni haber üçüncü ateşleme gerçekleşti,ulaştırma altyapı bakanı abdulkadir uraloğlu türksat anın uzay yolculuğunda ateşleme sürecinin başarıyla gerçekleştiğini duyurdu,Haberturk.com
other,istanbullulara iyi haber çalışma erken bitti,ibb haliç köprüsü metrobüs yolundaki asfalt yenileme çalışmasını bitirdi temmuz gecesi başlayan temmuzda sonlandırılması planlanan çalışma ekiplerin gayretiyle erken bitirildi d yolu haliç orta köprüsü kadıköy istikameti gece itibariyle,Haberturk.com
other,baba vahşetinden ay sonra acı haber,kocaelide annesi ağabeyini baba vahşetinde kaybeden kendisi ağır yaralanan nurseda acardan acı haber geldi ay boyunca yaşam mücadelesi veren genç kız hayatını kaybetti,Haberturk.com
other,siirtte süs havuzuna düşen yaşındaki çocuktan acı haber,siirtte evlerinin bahçesindeki süs havuzuna düşen yaşındaki ömer asaf pekedis hayatını kaybetti,Hurriyet.com.tr
other,sarıyerde denizde kaybolmuştu acı haber ersin oralın cansız bedenine ulaşıldı,istanbulda sarıyer kısırkaya plajında denize girdikten sonra denizde kaybolan yaşındaki ersin oralın cenazesine ulaşıldı,Hurriyet.com.tr
other,kendisini bıçaklayan oğlundan şikayetçi olmamıştı acı haber geldi,bursada psikoloji sorunları olduğu iddia edilen yakup demirboğa annesi gülçin demirboğa evdeyken onu başka kadın yatakta gördüm diyerek babası süleyman demirboğayı karnından bıçakladı polise verdiği ifadede oğlundan şikayetçi ol,Hurriyet.com.tr
other,edirnede minibüsten düşen ufuk çelikten gün sonra acı haber,edirnede sürücüsünün seyir halindeyken kapısını açtığı yolcu minibüsünden düşen altmış üç yaşındaki ufuk çelik gündür tedavi gördüğü hastanede yaşamını yitirdi,Hurriyet.com.tr
other,bakan yumaklıdan iyi haber yangının tamamı kontrol altında,yurt genelinde çıkan yangınlar hakkında açıklama yapan tarım orman bakanı ibrahim yumaklı ü orman yangını ü orman dışı yangın olmak üzere arkadaşlarımız bütün yurt çapında yangınla mücadele etti yangınların tamamı kontrol altına alındı,Hurriyet.com.tr
technology,son dakika türksat uzaya fırlatıldı,son dakika haber türkiyenin yerli milli haberleşme uydusu türksat abdnin florida eyaletindeki cape canaveral uzay kuvvetleri istasyonundan spacexe ait falcon roketiyle uzaya fırlatıldı fırlatılmasının inci dakikası sonrasında ise geçic,Hurriyet.com.tr
entertainment,ünlü oyuncu dört yıldır nişanlı düğünden kaçıyor ikna görevi eski eşe düştü iyi adam aslında kaçırma,onlar bundan tam dört yıl önce yaşadıkları aşkı resmiyete taşıyıp ömür boyu birlikte kalma kararı aldılar parmaklarına nişan yüzükleri takıldı zamandan yana herkes en azından gizli olsa evlilik haberi bekliyor ünlü çiftten beklenen hab,Hurriyet.com.tr
other,kahreden haber yorgun mermi aylık bebeği hayattan kopardı,aydının söke ilçesinde yaşanan olay yürekleri dağladı yoldan geçen düğün konvoyundan ateşlenen yorgun mermi evde annesiyle birlikte oynayan bebeğin başına isabet etti aylık bebek tüm müdahalelere rağmen kurtarılamadı,Haberturk.com
other,kardeşi dayısını başından vurmuştu acı haber geldi,ankarada yaşındaki bekir şanal dün çıkan tartışmanın ardından dayısını kardeşini vurmuş ardından kendine ateş etmişti başlarından yaralanan iki kişi tedavi gördükleri hastanede hayatını kaybetti,Haberturk.com
other,neşe yıllık evliydi eşi ondan haber alamadı büyük acı,diyarbakırda yıldır evli olduğu eşinden haber alamayan yşnin yardım istediği komşuları evden yanık kokusu geldiğini belirterek ihbarda bulundu adrese sevk edilen itfaiye ekiplerinin kapıyı kırıp girdiği evde yaşındaki neşe şimşekin kalp krizi,Haberturk.com
other,trt haber asyapasifik yayıncılar birliği abu haber grubu başkanlığına seçildi,trt haber haber koordinatörü ahmet görmez asya pasifik yayın birliği abu haber grubu başkanı seçildi anadolu ajansı,Anadolu Agency
other,abu haber grubu trt habere emanet,trt haber haber koordinatörü ahmet görmez asya pasifik yayın birliği abu haber grubu başkanı seçildi anadolu ajansı,Anadolu Agency
other,izmirde feci olay sağanak yağış sonrası elektrik akımına kapılan kişiden acı haber,izmirin konak ilçesinde sağanak yağıştan kaçmaya çalışırken elektrik akımına kapılan kadın kişi hayatını kaybetti polis ekipleri olay yerinde güvenlik önlemi alırken elektrik firması yetkilileri incelemelerde bulundu,Hurriyet.com.tr
other,diyarbakırmardin sınırındaki anız yangınında acı haber ölü sayısı e yükseldi,diyarbakır mardinin mazıdağı ilçeleri arasındaki bölgede çıkan yerleşim yerlerine sıçrayan yangında zekiye erdenlinin hayatını kaybetmesi ölü sayısı on beşe çıktı,Hurriyet.com.tr
other,gündür haber yerde aranıyordu kayıp profesörün cesedi korkunç halde bulundu,eskişehirde gün önce evinden çıktıktan sonra kendisinden haber alınamayan eskişehir teknik üniversitesinde estü görevli öğretim üyesi prof dr bekir karasunun porsuk çayında ellerinden iple bağlanmış halde cesedi bulundu başsavcılık cinayet,Hurriyet.com.tr
other,ankaradaki vahşette kan donduran detaylar katliamdan önce anneyi arayıp haber vermiş çocukların baba yapma sesini duyulmuş,ankaranın çankaya ilçesinde oğlu kızını tabancayla öldürüp aynı silahla intihar eden inşaat mühendisi murat keklikin olay öncesi eşi cemile yıldız kekliki arayarak çocukları öldüreceğini söylediği ortaya çıktı,Hurriyet.com.tr
other,manisada selin öztürkten gündür haber alınamıyor kızımı bulacağım bulacağım,manisanın şehzadeler ilçesinde annesinin evinden babama gidiyorum diyerek çıkan selin öztürkten gündür haber alınamıyor soruşturma cinayet şüphesiyle derinleştirilirken bayramının kendilerine zehir olduğunu söyleyen yeliz karalar an ö,Hurriyet.com.tr
technology,huawei mate serisinden kötü haber nmde kalıyor,huawei mate serisine güç vermesi beklenen huawei kirin performansıyla beklentilerin altında kalabilir yonga setinin nm üretim sürecinden çıkacağı söyleniyor,Donanimhaber.com
other,dün bebeğini kaybetti sabah acı haber geldi özlem kardeşi rojbin kurtarılamadı,mardinin mazıdağı ilçesinde tir otomobilin çarpıştığı kazada karnındaki aylık bebeğini kaybeden yaşındaki özlem nerse karakaş yaşındaki kız kardeşi rojbin nerse tedavi gördükleri hastanede kurtarılamadı,Haberturk.com
other,rizede gündür kayıptı ormanlık alanda ölü bulundu,rizenin pazar ilçesinde kendinden gündür kendisinden haber alınamayan ismet vardalın ormanlık alanda ölü olarak bulundu,Hurriyet.com.tr
entertainment,heyecanla beklenen batman dizisinden kötü haber,içerik ilk olarak heyecanla beklenen batman dizisinden kötü haber adresinde yayınlandı teknoloji haberleri shiftdeletenet,Shiftdelete.net
other,trt haber kanalı haber koordinatörü görmez abu haber grubu başkanı seçildi,trt haber kanalı haber koordinatörü ahmet görmez asya pasifik yayın birliği abu haber grubu başkanı seçildi,Haber7.com
entertainment,internet haber sitelerinin sonu geliyor,türkiyedeki internet yayıncılığını büyük tehlike bekliyor çoğu yayıncı tehlikenin farkında videomuzda tehlikenin olduğunu alınması gereken önlemleri ele aldık,Shiftdelete.net
politics,xiaomi mix fold için kötü haber sınırlı olacak,xiaominin merakla beklenen katlanabilir telefonu xiaomi mix fold önceki iddiaların aksine dünya çapında piyasaya sürülmeyecek detaylar,Donanimhaber.com
sports,hande baladından kötü haber,filenin sultanlarından hande baladın sakatlığı nedeniyle milletler liginin final etabında yer almayacağı öğrenildi,Odatv.com
other,bodrumda kaybolan yaşındaki kadın ölü bulundu,muğlanın bodrum ilçesinde gündür haber alınamayan yaşındaki kadının cansız bedeni bulundu,Haberturk.com
politics,cumhurbaşkanı erdoğan yarın putinle görüşecek,son dakika tass haber ajansının bildirdiğine göre rusya devlet başkanı putin cumhurbaşkanı erdoğanla yarın astanada görüşecek,Haberturk.com
other,gaziantepte gündür kayıp olan engelli bulundu,gaziantepin islahiye ilçesinde gündür kendisinden haber alınamayan yaşındaki zihinsel engelli ali gülsoy bulundu,Haberturk.com
other,evinde bıçaklanarak öldürüldü,sivasın şarkışla ilçesinde kendisinden haber alınamayan kişinin evinde bıçaklanarak öldürüldüğü belirlendi,Haberturk.com
other,kahreden olay oğlunu bulmak için panikle gölete girdi can kaybı,balıkesirde gölete giren yaşındaki oğlu emirhan çakırdan haber alınamayan anne gülnar çakır oğlunu bulmak için suya girdi anne oğlu gölette hayatını kaybetti,Hurriyet.com.tr
entertainment,sinem kobaldan sevindiren haber,kenan imirzalıoğlu evlenip anne olduktan sonra oyunculuğa ara veren sinem kobal yıl sonra ekrana dönmeye hazırlanıyor,Odatv.com
other,clint eastwoodu yıkan haber,clint eastwoodun sevgilisi christina sandera yaşında hayatını kaybetti,Odatv.com
politics,iranda pezeşkiyan önde,iranda üncü dönem cumhurbaşkanlığı seçimlerinin ikinci turunda sandıklardan alınan ilk resmi olmayan sonuçlara göre reformist aday mesud pezeşkiyan muhafazakar aday said celilinin önünde bulunuyor reuters haber ajansına konuşan iranlı kaynak pez,Haberturk.com
entertainment,kadir inanırdan kötü haber,mart ayında beynine üçüncü kez pıhtı atması sonucu operasyon geçiren usta oyuncu kadir inanır yeniden yoğun bakıma kaldırıldı,Haber7.com
other,evinde yalnız yaşayan gazi ölü bulundu,aydın nazillide kendisinden süredir haber alınamayan yaşındaki gazi hayati uğursoy yalnız yaşadığı evinde ölü bulundu,Haberturk.com
other,ormanda kaybolan yaşlı adam dere yatağında ölü bulundu,bursa inegölde odun toplamak için ormana giden kendisinden haber alınamayan yaşlı adam dere yatağında ölü bulundu,Haberturk.com
other,bodrumu sarsan tutuklama,habertürk haber merkezinin haberine göre iş insanı ömer deniz kocadon kızının yaşındaki arkadaşını istismar etmekle suçlanıyor,Haberturk.com
politics,trumpa iyi haber kısmi dokunulmazlık,abd yüksek mahkemesi hakkındaki ocak kongre baskınındaki rolü başkanlık seçimlerine müdahale iddiaları için eski başkan donald trumpın bazı konularda dokunulmazlığı bulunduğuna hükmetti,Odatv.com
other,yanan ormanlardan iyi haber var,muğlada geçtiğimiz yıllarda meydana gelen yangınlarda zarar gören ormanlık alanlar yoğun çalışmalarla yeniden yaşarmaya başladı,Odatv.com
entertainment,ibrahim çelikkoldan korkutan haber,motor tutkusuyla bilinen oyuncu ibrahim çelikkol geçirdiği kaza nedeniyle kaburgalarından omzundan yaralandı,Odatv.com
entertainment,engin polata kötü haber,kara para aklama davasında savcılık örgüt yöneticisi konumunda bulunan engin polat hakkında yıl hapis cezası talep etti,Odatv.com
entertainment,kadir inanırdan kötü haber,üç gündür yoğun bakımda olan kadir inanırın sağlık durumu hayranları tarafından büyük merakla takip ediliyor yeşilçamın efsanevi oyuncusunun sağlık durumu hakkında yeni gelişmeler var kadir inanırın son durumu,Odatv.com
sports,kate middletondan haber var,kanser tedavisi nedeniyle sosyal yaşamdan uzak durmak zorunda kalan kate middletonun wimbledon tenis turnuvası finaline gideceği açıklandı,Odatv.com
other,pençe kilitten acı haber,milli savunma bakanlığı msb pençekilit operasyonu bölgesinde askerimizin şehit olduğunu açıkladı,Odatv.com
sports,serena williamsı yıkan haber,tenis efsanesi serena williamsın eşi yakalandığı amansız hastalığı açıkladı,Odatv.com
other,batmandan kahreden haber öldüren ses,batmanda kahreden olay yaşandı kentte sabah saatlerinde balkonda uyuduğu sırada gök gürültüsünden korkup kalp krizi geçiren yaşındaki büşra ceren imir hayatını kaybetti,Haber7.com
other,selinden gündür haber alınamıyor,manisanın şehzadeler ilçesinde annesinin evinden babama gidiyorum diyerek çıkan selin öztürkten gündür haber alınamıyor,Haber7.com
other,yaşlı kadın evinde ölü bulundu,çorumda süredir kendisinden haber alınamayan yaşındaki sündüs ülker evinde ölü bulundu vücudunda darp kesi izine rastlanmayan ülkerin kesin ölüm nedeni yapılacak otopsi sonucu belirlenecek,Haberturk.com
sports,kayserispora majid hosseiniden kötü haber,kayserisporun iranlı savunma oyuncusu majid hosseini yeniden ameliyat oldu deneyimli savunmacı sezonun ilk yarısında forma giyemeyecek,Haber7.com
sports,di mariadan beşiktaşa kötü haber,beşiktaşın gündeminde olan angel di maria benfica olan sözleşmesini haziran e uzattı,Haber7.com
technology,gözler yaşlı xbox game pass için kara haber geldi,hafta içerisinde oyuncuların kafasında soru işaretleri oluşturan microsoft game pass için önemli açıklamalar yaptı haberler kötü,Shiftdelete.net
technology,samsung galaxy s serisi üç yerine iki modelle gelebilir,yeni haber samsung galaxy s serisinin üç yerine iki farklı modelle geleceğini iddia ediyor peki seride hangi model olmayacak,Chip.com.tr
other,arnavutköyde drifte bin lira ceza,istanbulun arnavutköy ilçesinde fc ma trafikte drift atıp anları görüntüledi yaşanan anlar başka vatandaş tarafından cep telefonu kamerası kaydedilip polise haber verilince görüntülerden tespit edilen şahsa toplam bin lira ceza kes,Hurriyet.com.tr
other,kaza şüphesi doğru çıktı yakınlarını ararken yıkıldılar,sakaryanın karasu ilçesinde yakınlarının haber alamadığı eyüp nesilin kazada hayatını kaybettiği belirlendi akrabaları nesilin kullandığı aracı su kanalına devrilmiş çalışır halde buldu,Haberturk.com
sports,di maria imzayı atıyor,beşiktaşa angel di maria transferinde kötü haber geldi portekiz basınında yer alan haberlere göre arjantinli yıldız benfica yeniden anlaşmaya vardı,Haberturk.com
other,arkadaşları ulaşamadı genç kız ölü bulundu,son dakika haberi denizli pamukkalede arkadaşlarının haber alamadığı yaşındaki aliye hakan yaşadığı apart dairesinde ölü olarak bulundu genç kızın şüpheli ölümüyle ilgili soruşturma başlatıldı,Haberturk.com
entertainment,haluk leventten hayranlarını korkutan haber,ahbapın kurucu başkanı haluk levent dün antalyada verdiği konser sonrası hastaneye kaldırıldı hastanede olan leventin sağlık durumunun iyi olduğu öğrenildi,Odatv.com
entertainment,kadir ezildiden hayranlarını sevindiren haber,renkli kişiliği temizlik tutkusu kısa sürede adını tüm türkiyeye duyuran fenomen sunucu kadir ezildiden hayranlarını sevindiren haber geldi,Odatv.com
other,veli erenden yıldır iz yok,eğlenmek için izmir alaçatıya giden temmuz ten beri kendisinden haber alınamayan veli eren atayın kaybolmasının üzerinden yıl geçti yer arandı atayın izine rastlanmadı acılı anne ebru atay işimiz ihbara kaldı dedi,Hurriyet.com.tr
other,profesör için kayıp başvurusu,eskişehir teknik üniversitesi öğretim görevlisi prof dr bekir karasudan gündür haber alınamıyor ailesinin kayıp başvurusu üzerine karasu için arama çalışması başlatıldı,Haberturk.com
sports,real madridde arda güler kararı,ispanyol basını arda gülerin real madriddeki geleceği ilgili flaş haber yaptı öte yandan tffnin hazırladığı özel videoda arda gülerin telefonuna gelen mesajlar sosyal medyayı salladı,Haberturk.com
other,yaradan oğlumuzu bize bağışladı,eşi tolga savacının ani vefatıyla sarsılan yazar nermin bezmen oğlunun yoğun bakımda olduğunu duyurmuş dua istemişti ünlü ismin oğlu cazım bezmenden müjdeli haber geldi,Haberturk.com
sports,fenerbahçeye moise keanden kötü haber,fiorentinanın juventustan moise keani kadrosuna katmak üzere olduğu öne sürüldü keanin adı fenerbahçe anılıyordu,Odatv.com
other,zonguldaktan kötü haber cansız bedenine ulaşıldı,zonguldakta denizde kaybolan kişinin cansız bedenine ulaşıldı,Odatv.com
other,aanın öncülüğünde hazırlanan yeşil hattımız çevre sergisi ankarada açıldı,aa öncülüğünde ispanyol efe haber ajansı italyan ansa ajansı yunanistan haber ajansının amna katkılarıyla hazırlanan iklim değişikliği çevre konularını ele alan yeşil hattımız çevre isimli fotoğraf sergisi başkent ankarada açıldı anadolu,Anadolu Agency
other,pençekilitten acı haber geldi,milli savunma bakanlığı pençe kilit operasyonu bölgesinde arama tarama faaliyeti esnasında eyp patlaması sonucu yaralanan gülhane eğitim araştırma hastanesinde tedavisi devam eden piyade yarbay demirkanın yapılan tüm müdahalelere rağmen kurtarılamaya,Odatv.com
other,cinsiyet değiştirenlere kötü haber başvuru reddediliyor,cinsiyet değiştirme ameliyatları sonrası yaşanan olay gündem oldu cinsiyet değiştirerek kadın olan kişinin sosyal sigortalar kurumuna başvurarak ölen babasının maaşını almak için verdiği dilekçeye gelen cevap merak uyandırdı,Odatv.com
sports,fenerbahçelilere kötü haber lugano bilet satmayacak,uefa şampiyonalar ligi eleme turunda fenerbahçenin rakibi lugano türk taraftarlara bilet satılmayacağını duyurdu,Odatv.com
sports,ancelottiye kötü haber e yok,carlo ancelottinin çalıştırdığı real madridin tecrübeli yıldızı david alabanın sakatlığı beklenenden kötü çıktı david alabanın e forma giyemeyeceği konuşuluyor,Haber7.com
other,baraj gölünde kaybolan gençten acı haber geldi,adanada dün yüzmek için girdiği seyhan baraj gölünde kaybolan muharrem akkoçun cansız bedenine ulaşıldı,Haber7.com
other,konyadan yürekleri yakan haber alevlerin içerisinde kaldılar,konyanın kulu ilçesinde evde çıkan yangında kişi yaşamını yitirdi,Haber7.com
other,denize giren polis memurundan acı haber,sarıyerde kuzeniyle birlikte denize giren polis memuru numan çebi akıntıya kapılması sonucu boğularak hayatını kaybetti kurtarılan kuzeni serdar kocaman ise kaldırıldığı hastanede yoğun bakım sevisinde tedavi altına alındı,Haber7.com
other,batmanda haber alınamayan öğretmen evinde ölü bulundu,batmanda süredir kendisinden haber alınamayan yaşındaki öğretmen evinde ölü bulundu,Odatv.com
sports,son dakika servet yardımcı tff başkanlığı için adaylıktan çekildiğini açıkladı,türkiye futbol federasyonunda yapılacak olan başkanlık seçimi için önce adaylığını açıklayan servet yardımcı karar değiştirdiğini duyurdu,Hurriyet.com.tr
other,son hava durumu tahminleri il il yayınlandı hafta sonu haziran hava nasıl olacak meteorolojiden istanbula son dakika yağış uyarısı,son dakika hava durumu tahminleri il il meteoroloji tarafından yayınlandı ülkenin ilinde hava sıcaklıkları haziran ayında mevsim normallerinin üzerinde seyrederken hafta ortasından itibaren sıcaklıklar düştü meteoroloji genel müdürlüğünün son hava,Hurriyet.com.tr
