category,temizlenmis_title,temizlenmis_description,source
politics,cumhurbaşkanı dış politika güvenlik başdanışmanı kılıç alman bakan pentzi kabul etti,cumhurbaşkanı dış politika güvenlik başdanışmanı büyükelçi akif çağatay kılıç almanya hessen eyaleti federal avrupa işleri bakanı manfred pentz beraberindeki heyeti kabul etti,Odatv.com
economics,merkez bankası faiz kararını açıkladı,merkez bankası para politikası kurulu bugün faiz kararını açıkladı geçen ay politika faizini yüzde sabit bırakan banka ay sabit tutulmasına karar verdi,Odatv.com
economics,küresel piyasalar karışık seyrediyor,abd merkez bankasının fed sene iki kez faiz indirimine gideceği beklentisi abd borsalarında risk iştahını artırsa ülkede gerçekleştirilecek seçimin sonuçlarının oluşturduğu belirsizliklerle asyada yön arayışı öne çıkıyor,Haberturk.com
politics,tbmm başkanı kurtulmuş abd düşünce kuruluşu temsilcileriyle buluştu,kurtulmuş yakın çevremizde var olan sorunların süratle çözülmesi barış perspektifinin ortaya konularak bölge ülkeleri arasında normalleşmenin temin edilmesi dış politika perspektifimizde önemli başlıklarımızdan birisidir dedi,Haber7.com
economics,tcmb faiz kararını salı günü açıklayacak,merkez bankası para politikası kurulu faiz kararını temmuz salı günü açıklayacak banka önceki toplantıda politika faizini yüzde seviyesinde sabit tutmuştu,Haber7.com
economics,alman devinden türkiye yorumu indirim bekliyoruz,deutsche bank yetkilisi türkiyede yıl sonu itibarıyla enflasyonun yüzde seviyesine gerilemesini politika faizinde ise kasım aralık olmak üzere baz puan faiz indirimi öngördüğünü açıkladı,Haber7.com
economics,fedin bej kitabı ekonomik büyümenin yavaşlamasının beklendiğini ortaya koydu,abd merkez bankası fed ülkede yaklaşan seçimler iç politika jeopolitik çatışmalar enflasyona ilişkin belirsizlik nedeniyle gelecek ayda ekonominin yavaş büyümesinin beklendiğini bildirdi,Haber7.com
other,nüfus artışı için yeni önlemler yolda,doğum oranlarındaki tarihi düşüşler tüm dünyayı alarma geçirdi türkiye son dönemde azalan doğumlar için dünyadaki örnekleri inceleyerek politika geliştirecekdevamı için tıklayınız,Sabah.com.tr
economics,merkez bankası kararı sonrası dolardan ilk tepki,merkez bankası politika faizini açıklamasının ardından güne lira seviyesinden başlayan dolar kuru den işlem görüyor euro kuru seviyesinde seyrediyor,Haber7.com
economics,merkez bankası zaman faiz indirecek tepav tarih verdi,türkiye ekonomi politikaları araştırma vakfı tepav aylık ekonomik değerlendirme raporunda tcmbnin politika faizini sınırlı aşamalı indirmeye başlaması için koşulların eylül ayından itibaren uygun hale gelebileceği belirtildi,Haber7.com
technology,abdnin büyüme verisi bekleniyor,geçen hafta artan jeopolitik riskler küresel yazılım sorunu abd borsalarında teknoloji hisseleriyle başlayan düşüşlerin dünya geneline yayılmasının etkisiyle satış ağırlıklı seyir izlenirken gözler abdde açıklanacak büyüme verisine çevrildi,Haberturk.com
economics,piyasa tcmbnin haziranı pas geçmesini bekliyor,bloomberg htnin faiz anketine katılan kurumlar haziranda gerçekleşecek toplantıda türkiye cumhuriyet merkez bankasının tcmb politika faizini yüzde seviyesinde sabit tutacağını öngördü,Haber7.com
sports,şehir efsanesinden kurtul artık türkiye,futbol kültürü olmayan ülkenin hakem konusunda sağlıklı temelde birleşmesini beklemek elbette hayal,Hurriyet.com.tr
politics,yunan medyasından skandal başlıklar türkler gece ansızın gelebileceğini hatırlatıyor dediler barış harekatına gösteri yorumu,kıbrıs barış harekatının yılı yunan medyası manşetlerinde geniş yer buldu yunan basınında neredeyse tüm manşetler türkiye kktcnin yıl kutlamalarıyla dolarken kuzey kıbrıs türkiye ilgili provakatif başlıklara yer verildi,Hurriyet.com.tr
entertainment,iman casablanca türkiye benim kaderim başka yere gidemem,faslı oyuncu iman casablanca müdür adlı singleını beğeniye sundu oyunculuktan önce şarkıcılık deneyimi olduğunu söyleyen casablanca projelerini türkiyeye olan sevgisini anlattı fasta aile baskısından kaçarak türkiyeye geldiğini ifade eden,Hurriyet.com.tr
entertainment,hülya koçyiğit ali şen sette linçten korudu,hülya koçyiğit geçen gün türkiye kültür yolu festivali kapsamında trabzonlular araya geldi,Hurriyet.com.tr
sports,yıldızlarla dolu süper ligin yol haritası belli oldu,süper ligde sezonunun fikstürü dün türkiye futbol federasyonunun rivadaki merkezinde çekildi,Hurriyet.com.tr
sports,ismail uyanık tff başkanlığı için adaylıktan vazgeçti,önce türkiye futbol federasyonu başkanlığına aday olduğunu açıklayan ismail uyanık kararından vazgeçtiğini açıkladı,Hurriyet.com.tr
sports,tff başkan adayı ibrahim hacıosmanoğlundan fenerbahçeye övgü en muhteşem,türkiye futbol federasyonu başkan adayı ibrahim hacıosmanoğlu seçim gündemine dair açıklamalarda bulundu,Hurriyet.com.tr
sports,euro puan durumu fikstür türkiye euro puanı kaç kaçıncı sırada euro puan durumu türkiye f grubu,euro puan durumu güncel maçların ardından merak ediliyor milli takımımız f grubunda mücadele ediyor türkiye portekiz maçı sonrası euro puan durumu f grubu araştırılıyor avrupa futbol şampiyonası grup maçlarının haziranda biteceği tur,Hurriyet.com.tr
sports,tff başkanı mehmet büyükekşi ilk hedefimiz gruptan çıkmak,türkiye futbol federasyonu tff başkanı mehmet büyükekşi ilk kez avrupa şampiyonasına galibiyetle başladıklarına dikkat çekerek avrupa futbol şampiyonasında euro ilk hedeflerinin gruptan çıkmak olduğunu söyledi,Hurriyet.com.tr
entertainment,beyaz perdenin yeni ikilisi kerem bürsin melis sezen,kerem bürsin melis sezen son of richin türkiye uyarlamasında başrolü paylaşacak temmuzda sete çıkacak ikili geçen gün filmin okuma provalarında araya geldi,Hurriyet.com.tr
sports,bozkurt yine görevini yaptı,türk mitolojisine göre türklerin ergenekondan çıkışına öncülük yapan bozkurt kez türkiye milli futbol takımımızın avusturyayı yendiği maç sonrası almanyada ortaya çıktı,Hurriyet.com.tr
politics,temmuzu unutmayacağız,türkiye genelinde fetönün temmuz hain darbe girişiminin inci yılı nedeniyle anma etkinlikleri yapıldı sanat dünyasının ünlü isimleri temmuzun yıldönümünde sosyal medyada paylaştıkları duygusal mesajlarla şehitleri andı,Hurriyet.com.tr
sports,tff adaylık başvurusu kabul edilen isimleri açıkladı mehmet büyükekşi yeniden aday,türkiye futbol federasyonu temmuzda yapılacak olağan mali seçimli genel kurulunda başkan adayı olmak için başvuruları kabul edilen isimleri açıkladı mevcut başkan mehmet büyükekşinin yeniden aday olduğu resmileşti,Hurriyet.com.tr
sports,avrupa türkiyenin avusturya karşısındaki lik zaferini konuşuyor gezegendeki tüm bültenleri değiştirmek istedi arda gülerin icadı merih demiralın infazı,millilerin avrupa futbol şampiyonasındaki euro yürüyüşü avrupa basınında manşetlerde yer aldı,Hurriyet.com.tr
politics,türkiye tek bloka sıkışamaz,cumhurbaşkanı erdoğan dış politikada sıkılı yumruklar açılmalı mesajı verdi biz batı için doğuya sırtımızı döneriz doğu için batıyı ihmal ederiz türkiye coğrafi beşeri ekonomik tarihi bağları itibarıyla tek bloka sıkıştırılamayacak ü,Hurriyet.com.tr
entertainment,içinden ilham perileri geçen şarkılar,kimi yaz mevsimi için şarkı yazıp besteler kimi arzu nesnesi çanta için ayrılıksa daim ilham perilerinin kanatlarında bayram sonrası müzik piyasası hareketlenirken yeni çıkan teklilere göz atalım,Hurriyet.com.tr
politics,tbmm iliç maden kazası araştırma komisyonu işçi sendikalarını dinledi,türkiye büyük millet meclisi tbmm iliç maden kazası araştırma komisyonu türkiye işçi sendikaları konfederasyonu türk iş hak işçi sendikaları konfederasyonu hak iş türkiye devrimci işçi sendikaları konfederasyonu disk yetkililerini dinledi,Hurriyet.com.tr
other,dünyada ülkede ebeveyn izni olarak tanımlanıyor,tüik verilerine göre doğum oranları hızla düşüyor türkiye yaşlanıyor açıklanan rakamların ardından cumhurbaşkanlığı azalan doğum oranlarının alarm verdiğini söyleyince aile sosyal hizmetler bakanlığı çalışan annelere yönelik destek paketi hazırlığı,Hurriyet.com.tr
sports,türkiye gruptan nasıl çıkar,euro f grubunda mücadele eden milli takımımız puan ikinci sırada yer alıyor gruptaki ilk maçında gürcistanı yenen ayyıldızlı ekibimiz ikinci maçında ise portekize mağlup oldu turvudaki üçüncü son maçında çekya karşılaşacak,Haberturk.com
other,türkiye gri listeden çıktı,mali eylem görev gücü fatf türkiyenin gri listeden çıktığını açıkladı,Haberturk.com
other,papadan türkiye ziyareti,türkiyeye ilk kez te gelen papa franciscus te istanbul iznike uğramayı düşündüğünü açıkladı katoliklerin ruhani lideri olan papa tüm kalbimle gerçekleştirmek istediğim gezi dedi,Haberturk.com
sports,avusturyatürkiye maçı tarihi,türkiye milli futbol takımı avrupa futbol şampiyonası f grubunu ikinci sırada tamamlayarak son turunda avusturyanın rakibi oldu grupta başarılı performans sergileyen ay yıldızlılar euro macerasına son turunda oynayacağı avusturya maçı i,Haberturk.com
sports,dış basında türkiye yankısı,milli futbol takımı eurote çekyayı mağlup etti son turuna yükseldi tarihi zafer ülkede olduğu gibi dış basında büyük yankı yarattı yazılanlar,Haberturk.com
other,uzaktan türkiye haritasını andırıyor,giresunun keşap ilçesindeki şahinkaya tepesi yamacındaki kayalık alanın türkiye haritasına benzerliğiyle doğa tutkunları için merak uyandıran noktalardan haline geldi,Haberturk.com
other,türkiye deprem risk haritası,mtanın yayımladığı yenilenen türkiye diri fay haritasına göre yurt genelinde ilde üzeri büyüklükte deprem üretebilecek potansiyelde diri fay yer alıyor deprem kuşağında yer alan türkiyede yurt genelinde sarsıntılar yaşanmaya devam ediyor iş,Haberturk.com
economics,fatf başkanından türkiye açıklaması,fatf dönem başkanı kumar türkiyenin gri listeden çıkarılan iki ülkeden olduğunu belirterek türkiye kara para aklama terörün finansmanıyla mücadelesini iyileştirmek için önemli adımlar attığını teyit etti dedi,Haberturk.com
economics,moodysten türkiye açıklaması,moodys sektör uygulama lideri mohamed daoud türkiyenin mali eylem görev gücü fatf gri listesinden çıkarılmasına ilişkin gelişmenin türkiyenin itibarını uluslararası alanda artırması yabancı yatırımları avrupa abd kurumlarıyla ilişkileri pota,Haberturk.com
other,türkiye alışveriş haritası açıklandı,trendyol yılının ilk yarısına ilişkin alışveriş verilerini paylaştı ilk ayda en cilt bakım kadın giyim ürünlerinin satışı gerçekleşti yaklaşık milyon trendyol satıcısı milyon ürünü türkiyenin dört yanındaki müşterileriyle buluştur,Haberturk.com
technology,bakan kacır türkiyeye önemli kazanımlar getirdi,sanayi teknoloji bakanı mehmet fatih kacır aslında uydu teknolojilerinde takımına girdik diyebiliriz ilk deyiz çünkü başarabilen dünyada sadece ülke var artık böyle başarı için tübitak aselsan tusaş ctech türksat ekipleri ge,Hurriyet.com.tr
other,nostalji rüzgârı hız kesmiyor,retro tınıların peşine düşenler klasikleri yeniden yorumlayanlar özellikle ler lara olan ilgi bitmiyor hafta jain hera aslan anıl şallıelkoray avcı aleyna kalaycıoğlunun teklilerini dinledik,Hurriyet.com.tr
politics,schengen istatistiklerinde çarpıcı türkiye detayı,avrupa komisyonu verilerine göre yılında schengen vize başvurusu en reddedilen ikinci ülke olan türkiye ret verilen başvurulara milyon avro en para harcayan ülke,Haberturk.com
politics,türkiye gri listeden çıkacak mı,cumhurbaşkanı yardımcısı cevdet yılmaz singapurda gerçekleştirilecek mali eylem görev gücünün fatf genel kurul toplantısında türkiyenin gri listedeki durumunun ele alınacağını belirterek burada teknik herhangi sıkıntı yok olumlu karar çıkacağı,Haberturk.com
politcs,abd türkiye birbirinden kopamaz,gazeteci aslı aydıntaşbaş türkiye abd ilişkilerinin yeniden ivme kazanması gerektiğini belirten yazı kaleme aldı iki ülkenin ortak noktası olduğunu ifade eden aydıntaşbaş türkiyenin çin iran rusyanın nüfuzunu sınırlamaya yardımcı olma k,Haberturk.com
sports,türkiye avusturya maçı zaman,türkiye avusturya maçı için geri sayım başladı grup aşamasını sırada tamamlayarak avrupa futbol şampiyonası macerasına son turundan devam eden ay yıldızlılar avusturyanın rakibi oldu peki euro türkiye avusturya maçı zaman saat kaçta,Haberturk.com
sports,türkiye çekya maçı zaman,milli futbol takımı euro f grubu üçüncü maçında çekya karşı karşıya geliyor ikinci maçların sona ermesinin ardından avrupa futbol şampiyonasında son turuna kalmayı garantileyen takımlar netleşmeye başladı grubunda oynadığı ilk maçında gürcis,Haberturk.com
other,türkiyealmanya arasında vize görüşmesi,içişleri bakanı ali yerlikaya almanya federal içişleri yurt bakanı nancy faeser berlinde araya geldi görüşmenin ardından açıklama yapan yerlikaya türk vatandaşlarının almanya vizesi alma sürecine ilişkin durumlarının nasıl iyileştirilebileceğ,Haberturk.com
sports,türkiye hollanda maçı zaman,euro son turu heyecanı türkiye avusturya maçıyla sona erdi milli takımımız son turu son maçında avusturyayı mağlup etti çeyrek finalde hollandanın rakibi oldu kapsamda sporseverler euro türkiye hollanda çeyrek final maçı,Haberturk.com
sports,avusturya türkiye maçı zaman,avusturya türkiye maçı heyecanına sayılı saatler kaldı grup aşamasını sırada tamamlayarak avrupa futbol şampiyonası macerasına son turundan devam eden ay yıldızlılar avusturya kozlarını payalaşacak peki euro avusturya türkiye maçı zam,Haberturk.com
sports,türkiye avusturya maçı zaman,milli futbol takımı f grubu üçüncü maçında çekya karşı karşıya geldi kıran kırana mücadelelere sahne olan maçta türkiye çekyayı skorla mağlup ederek son turunda avusturyanın rakibi oldu avrupa futbol şampiyonası son turu maçlarının ardı,Haberturk.com
sports,türkiye avusturya maçı zaman,türkiye avusturya maçı için geri sayım başladı grup aşamasını sırada tamamlayarak avrupa futbol şampiyonası macerasına son turundan devam eden ay yıldızlılar avusturyanın rakibi oldu peki euro türkiye avusturya maçı zaman saat kaçta,Haberturk.com
economics,türkiye çekyaya ihracat rekoru kırdı,türkiye milyon dolarla çekyaya tüm zamanların en yüksek ocakmayıs ihracatını gerçekleştirdi,Haberturk.com
other,türkiye birincisi ebrar enkazından çıktı,kahramanmaraşta yaşayan astın felaketi olarak nitelendirilen depremlere ebrar sitelerinde yakalanan efe talha palabıyık büyük başarıya imza atarak lgs türkiye birincisi oldu,Haberturk.com
sports,türkiye avusturya maçına portekizli hakem,euro son turunda oynanacak türkiye avusturya maçını portekizli hakem artur soares dias yönetecek,Haberturk.com
sports,türkiye hollanda maçı zaman,euro heyecanı çeyrek final maçları devam ediyor son turu turu son maçında avusturyayı mağlup etmeyi başaran milli futbol takımı çeyrek finalde hollandanın rakibi oldu zorlu mücadele öncesinde türkiye hollanda maçı zaman saat kaçta,Haberturk.com
politics,erdoğanesed görüşmesi zaman,yukaridaki başlığı atmadan önce erdoğan esed görüşecekler mi,Hurriyet.com.tr
sports,türkiye hollanda maçı zaman,türkiye hollanda maçı için geri sayım başladı almanyanın ev sahipliğinde düzenlenen euro te grup son turunda başarılı performans sergileyen ay yıldızlılar avusturyayı mağlup edip çeyrek finalde hollandaya rakip oldu peki türkiye hol,Haberturk.com
other,türkiye sığınmacılar üzerinden karıştırılmak isteniyor,bbp genel başkanı mustafa destici sığınmacılar üzerinden türkiyenin karıştırılmak istendiğini söyledi,Haberturk.com
sports,hollandatürkiye maçı zaman,milli futbol takımı türkiye avrupa futbol şampiyonası euro çeyrek final maçında hollanda karşı karşıya geliyor grup aşaması son turunda gösterdiği performansla turnuvaya damga vuran türkiye euro te yoluna emin adımlarla ilerliyor,Haberturk.com
politics,türkiyesuriye ilişkileriyle ilgili açıklama,türkiye suriye arasındaki ilişkiler normalleşme sürecine girerken rusya dışişleri bakanlığı sözcüsü mariya zaharovadan konuyla ilgili açıklama geldi normalleşmenin bölgede güvenliği artıracağını söyleyen zaharova iki taraftan yönde pratik,Haberturk.com
politics,türkiye mükemmel ilişkilerimiz var,isveç dışişleri bakanı tobias billström ülkesinin türkiye isveç nato arasında litvanyanın başkenti vilniusta düzenlenen üçlü görüşmede kararlaştırılan güvenlik anlaşmasına girme eşiğinde olduğunu kaydetti billström kişisel olarak işlerin planlandığı,Haberturk.com
technology,türkiye çevrimiçi alışverişte dünya üçüncüsü,ulaştırma altyapı bakanı abdulkadir uraloğlu dijital global genel bakış türkiye raporunda açıklanan nisan verilerine göre türkiyenin dijital medya alışkanlıklarını tercihlerini değerlendirdi bakan uraloğlu türkiyenin te internette geç,Haberturk.com
sports,hollandatürkiye maçı zaman,euro avrupa şampiyonası soluk soluğa devam ediyor türkiye çeyrek final maçında hollanda karşı karşıya gelmeye hazırlanıyor milli futbol takımı hollanda karşısında galibiyet alırsa yarı finale çıkmaya hak kazanacak peki hollanda türkiye maçı,Haberturk.com
sports,kimse türkiye karşılaşmak istemiyor,milli takım oyuncularından kaan ayhan hollanda maçı hakkında açıklamalarda bulundu,Haberturk.com
politics,türkiye karşıtı senatör suçlu bulundu,abdde rüşvet yolsuzluk suçlamalarıyla yargılanan demokrat partili new jersey senatörü bob menendez hafta süren yargılama sonucunda suçlu bulundu ayrı suçlamanın tamamından suçlu olduğuna karar verilen menendez maddelerin için yıla kada,Haberturk.com
economics,iab avrupa adex benchmark raporundan öne çıkanlar,iab europe adex benchmark raporunu yayınladı rapora göre avrupadaki dijital reklamcılık pazarı yüzde lik güçlü büyüme gösterdi milyar euro tüm zamanların en yüksek pazar değerine ulaştı türkiye dijital reklam yatırımlarının,Webrazzi.com
sports,milli futbol takımını coşturan sözler boydan boya afişlerle donatıldı oyuncular dünyadan izole edildi,millilerin antrenman sahası oyuncuları motive edici mesajların yer aldığı afişlerle donatıldı,Hurriyet.com.tr
politics,bakan göktaş türkiye yüzyılda gençlerin başarısı yükselmeye devam edecek,istanbul galata üniversitesi mezuniyet töreninde konuşan aile sosyal hizmetler bakanı mahinur özdemir göktaş türkiye yüzyılda gençlerin başarısı yükselmeye devam edecek türkiye yüzyılı gençlerin yüzyılı olacak dedi,Hurriyet.com.tr
politics,tbmm başkanı numan kurtulmuş demokrasilerde örgütlü sivil toplumların gücünün üstünde güç yok,tbmm başkanı numan kurtulmuş güçlü türkiye güçlü toplum anlayışıyla önümüzdeki döneme güçlü şekilde giriyoruz türkiye olarak karşımıza çıkan birtakım tehditlerden yılarak birtakım gelişmelerden çekilip geri adım atarak önümüzdeki fı,Hurriyet.com.tr
sports,türkiye euro te gruptan nasıl çıkar,avrupa futbol şampiyonası euro f grubuda portekizin ardında ikinci sırada bulunan milli takımı gruptaki son maçında çekya karşı karşıya geliyor haziran çarşamba günü saat oynanacak zorlu mücadele öncesinde türkiye euro te g,Haberturk.com
sports,türkiye hangi yıl dünya kupasında oldu,türkiye dünya futbolunun en prestijli organizasyonu olan dünya kupasında tarihi başarıya imza atarak yılında üçüncü olmuştur başarı türk futbolunun uluslararası arenada kazandığı en büyük başarılar arasında yer alır peki dünya kupası kaç yıl,Haberturk.com
politics,hırvatistan bosna hersekten türkiye açıklaması,hırvatistan bosna hersek dışişleri bakanları türkiye oldukça iyi ilişkilere sahip olduklarını ilişkilerin alanda gelişmesi için çalışmalarına devam edeceklerini belirtti,Haberturk.com
sports,türkiye için büyük fırsat,beşiktaşın avusturyalı eski futbolcusu veli kavlak yarın türkiye karşısında avusturyayı adım önde gördüğünü söyledi kavlak ayrıca türkiyenin hazırlık maçında rakibine kaybetmiş olmasının motivasyon açısından kırmızıbeyazlı takım için önemli,Haberturk.com
sports,türkiyeçekya euro maçı zaman,türkiye çekya maçına sayılı saatler kaldı f grubunda oynadığı ilk maçında gürcistanı mağlup etmeyi başaran ay yıldızlılar portekiz karşısında mağlup olarak son şansını son maça taşıdı kritik maç öncesinde türkiye çekya maçı zaman saat,Haberturk.com
sports,türkiye tehlikeli takım haline geldi,türkiyede dönem göztepe forması giyen portekiz milli takımının eski kalecisi beto teknik direktör vincenzo montellanın göreve gelmesiyle birlikte türkiyenin taktiksel yönünün kuvvetlendiğini belirterek sayede kırmızıbeyazlıların tehlikeli,Haberturk.com
sports,euro türkiyeçekya maçı zaman,milli futbol takımı euro f grubu üçüncü maçında çekya karşı karşıya geliyor f grubunda oynadığı ilk maçında gürcistanı mağlup etmeyi başaran ay yıldızlılar portekiz karşısında mağlup olarak son şansını son maça taşıdı kritik maç ön,Haberturk.com
sports,cumhurbaşkanı erdoğan türkiyehollanda maçını izleyecek,cumhurbaşkanı erdoğan avrupa şampiyonasında çeyrek finale yükselen milli futbol takımımızı desteklemek için azerbaycan programını iptal etti cumhurbaşkanı erdoğanın cumartesi akşamı türkiyehollanda maçını izlemek için berline gideceği öğrenildi,Haberturk.com
economics,türkiyeab ticaret diyaloğunda gümrük birliği mesajı,ticaret bakanı ömer bolat komisyonunun ekonomiden sorumlu başkan yardımcısı valdis dombrovskis brükselde düzenlenen türkiye avrupa birliği arasında yüksek düzey ticaret diyaloğu toplantısına katıldı ticaret bakanı ömer bolat uluslararası t,Haberturk.com
other,depremzede öğrenci yksde türkiye birincisi oldu,yükseköğretim kurumları sınavının yks türkiye birincilerinden malatyadaki depremzede öğrenci arda taşdemir oldu geçen yıl yksya giren istediği sonuç gelmeyince tercih yapmayan arda yıl yeniden girdiği sınavda türkiye birincisi,Haberturk.com
politics,türkiye yüzyılı maarif modeli davalık oldu,cumhuriyet halk partisi chp türkiye yüzyılı maarif modeline ilişkin idari işlemin iptali yürütmenin durdurulması talebiyle danıştayda dava açtı chp genel başkan yardımcısı suat özçağdaş türkiye yüzyılı maarif modeline kamuoyu sendikalar bazı siya,Haberturk.com
economics,türkiye sigorta ayda büyüdü,türkiye sigorta yılının ilk yarısında yüzde büyüyerek milyar tl prim üretti,Haberturk.com
politics,türkiye somali denizlerinde doğalgaz petrol arayacak,enerji tabii kaynaklar bakanı alparslan bayraktar türkiyenin somali denizlerinde blokta hidrokarbon kaynağı arayacağını bildirdi,Haberturk.com
other,eylem tok oğlunu tutuklayan abd iade dosyasında suça yeğen gülenin itiraflarına rağmen fetö elebaşının ifadesini bile almıyor,günlerdir türkiyede cinayet gibi kazanın zanlısı olan eylem tok oğlunun abdde tutuklanması yargılanması konuşuluyor,Hurriyet.com.tr
other,marmara denizinde uçan balık yakalandı türkiye deniz canlıları müzesine eklenecek,marmara denizi adalar açıklarında balıkçılar tarafından uçak balık yakalandı uzun süredir marmara denizinde uçan balıkların bulunmadığını belirten türkiye deniz canlıları müzesi kurucusu balıkçı kenan balcı havaların ısınması birlikte farklı tür balıkl,Hurriyet.com.tr
politics,bakan göktaş türkiyebelçika dostluğunun artarak devam etmesini temenni ediyorum,belçika türkiyenin türk işçilerin belçikaya göçünü kolaylaştırmak amacıyla imzaladığı göç anlaşmasının yılı gurbet kuşu festivali kutlandı programda konuşan aile sosyal hizmetler bakanı mahinur özdemir göktaş göçün yıl dönümüyle,Hurriyet.com.tr
economics,türkiye eticaret ekosistemi raporundan öne çıkanlar,türkiye eticaret ekosistemi raporunun sonuçları açıklandı iyzico dogma alares elektronik ticaret işletmecileri derneği etid iş birliğiyle hazırlanan raporda paylaşılan bilgilere göre yılında yüzde büyüyen eticaret sektörünün satış hac,Webrazzi.com
sports,ronald koeman hürriyete konuştu en arzulu futbolcular en iyi taraftar türkiyedeydi,hollanda milli takımı teknik direktörü ronald koemanla euro yarı finalinde ingiltereye yenildikleri maçın ardından kısa hoş sohbet gerçekleştirdik,Hurriyet.com.tr
politics,nato zirvesinde türkiyenin kazanımları,natonun washingtonda yapılan zirvesinde sonuç bildirgesi açıklanırken türkiyenin önem verdiği konunun metne yansıdığı görüldü,Hurriyet.com.tr
