category,temizlenmis_title,temizlenmis_description,source
politics,son dakikatansiyon anda yükseldi hizbullahtan israile rest nasrallah vurulmamış yerlerden hedef alınırsınız,israil ordusunun gazze şeridine yönelik havadan denizden karadan saldırıları gününde devam ediyor idfnin gece boyunca gazze şeridine düzenlediği saldırılarda sayıda filistinli hayatını kaybederken lübnanisrail cephesinde tansiyon yüks,Hurriyet.com.tr
politics,son dakika cumhurbaşkanı erdoğandan açıklamalar,son dakika haberi cumhurbaşkanı erdoğan demokrasi özgürlükler adasında şehit mustafa cambaz fotoğraf yarışması ödül töreninde açıklamalarda bulundu temmuzda ölüm kusanlara karşı destan yazdık diyen erdoğan insanlarımızı korkakça namertçe katle,Hurriyet.com.tr
other,lgs tercihlerinde son dakika ayarları,liselere geçiş sistemi lgs maratonun son etabı olan yerleştirme süreci sınava hazırlık gibi adayları zorlayan dönem haziranda başlayan tercih süreci yarın sona erecek tercih listesinin mutlaka okul yönetimine onaylatılması gerektiğini hatır,Hurriyet.com.tr
other,kontrol etmeden kesinlikle dışarı çıkmayın en hava sıcaklığı önemli uv indeksi anlama geliyor hangi sayı ifade ediyor,son dönemde meteoroloji bültenlerinde hava takip uygulamalarında sıklıkla karşımıza çıkan kavram var uv indeksi özellikle içinde bulunduğumuz yaz aylarında uv indeks değerini kontrol etmeden dışarı çıkmamak gerekiyor peki uv indeksi altında gördüğüm,Hurriyet.com.tr
politics,son dakika trump kongresi yakınlarında panik,abdnin milwaukee kentinde düzenlenen cumhuriyetçi parti ulusal kongresi yakınlarında polisin kişiyi vurarak öldürdüğü bildirildi,Hurriyet.com.tr
politics,son dakika haberi cumhurbaşkanı erdoğan abdde,son dakika haberi cumhurbaşkanı recep tayyip erdoğan nato devlet hükümet başkanları zirvesine katılmak üzere özel uçak tur abdnin başkenti washingtona gitti,Hurriyet.com.tr
politics,son dakika cumhurbaşkanı erdoğandan önemli açıklamalar,cumhurbaşkanı recep tayyip erdoğan cumhurbaşkanlığı külliyesinde düzenlenen temmuz demokrasi milli birlik günü anma programında açıklamalarda bulunuyor,Hurriyet.com.tr
politics,son dakika cumhurbaşkanı erdoğandan önemli açıklamalar,cumhurbaşkanı recep tayyip erdoğan polis akademisi mezuniyet töreninde açıklamalarda bulundu ekonomimize zarar verilmesine izin vermeyeceğiz diyen erdoğan cihan imparatorluğunun bakiyesi üzerine kurulan türkiye gibi devleti ırkçı lümpen faşizmin,Hurriyet.com.tr
other,yökdil başvurusu son dakika başladı,ösym son dakika duyusunda yökdil başvurusunun başladığı duyuruldu yükseköğretim kurumları yabancı dil sınavı yökdil başvuruları temmuz tarihinde sona erecek adaylar başvuru yapmak için ösym ais ekranını ziyaret ediyor peki yökdil başvurusu na,Haberturk.com
other,sadece dakika içinde vücut fonksiyonları tamamen kayboluyor sıcak çarpması bakın ölüme nasıl sebep oluyor,sıcak çarpması vücudu nasıl yavaş yavaş yok ediyor sadece dakika içinde organ yetmezliğine olabiliyor uzmanlar detay detay anlattı,Hurriyet.com.tr
other,gün etrafına gülücükler dağıtıp durdu göründüğü iyi değilmiş,dünyanın dört yanında hemen dakika takım olaylar oluyor üstelik bazıları tarihin gidişini değiştirecek türden hiçbiri ingiliz kraliyet ailesinin gelini ülkenin gelecekteki kraliçesi kate middleton konuşulmuyor akılda kalmıyor,Hurriyet.com.tr
politics,son dakika bakan uraloğlundan cnn türkte önemli açıklamalar,ulaştırma altyapı bakanı abdulkadir uraloğlu cnn türkte fulya öztürkün moderatörlüğündeki akıl çemberi programında gündeme ilişkin açıklamalarda bulunuyor,Hurriyet.com.tr
politics,son dakika istanbulda toplu taşımada indirimli karta yaş sınırı,ibb meclisinin temmuz ayı olağan toplantılarının üncüsü gerçekleştirildi istanbulda toplu taşımada öğrenci indirimine yaş sınırı getirildi ibb meclisinde alınan karar yaşından gün almış öğrencilerin indirim oranları yüzde düşürüldü,Hurriyet.com.tr
politics,son dakika hande fırat yazdı nato zirvesinde türkiyenin kazanımları,natonun washingtonda yapılan zirvesinde sonuç bildirgesi açıklanırken türkiyenin önem verdiği konunun zirvenin sonuç bildirgesine yansıdığı görüldü diplomatik kaynaklar natonun zirvesinin türkiyede yapılacağına dikkat çekerken türkiyenin,Hurriyet.com.tr
politics,son dakika yeni atama kararları resmi gazetede yayımlandı,cumhurbaşkanı recep tayyip erdoğan imzasıyla yeni atama kararları resmi gazetede yayımlandı metin kıratlı anayasa mahkemesi üyeliğine hakkı susmaz cumhurbaşkanlığı idari işler başkanlığına atandı,Hurriyet.com.tr
other,son dakika msb terörist etkisiz hale getirildi,mili savunma bakanlığından msb yapılan açıklamada irak suriyenin kuzeyinde teröristin etkisiz hale getirildiği bildirildi,Hurriyet.com.tr
politics,son dakika kripto varlıklara ilişkin düzenlemeler içeren kanun teklifi yasalaştı,son dakika haberine göre kripto varlıklara ilişkin düzenlemeler içeren sermaye piyasası kanununda değişiklik yapılmasına dair kanun teklifi tbmm genel kurulunda kabul edilerek yasalaştı,Hurriyet.com.tr
other,son dakika resmi gazetede yayımlandı ehliyet sınavlarına yeni düzenleme,özel motorlu taşıt sürücüleri kursu yönetmeliğinde değişiklik yapılmasına dair yönetmelik resmi gazetede yayımlandı yeni düzenlemeye göre sürücü belgesi sınavlarına başkasının yerine girenler girmeye teşebbüs edenler kendi yerine başkasını sınava,Hurriyet.com.tr
politics,son dakika cumhurbaşkanı erdoğan natoda önemli açıklamalarda bulunuyor,cumhurbaşkanı recep tayyip erdoğan nato zirvesi sonrası açıklamalarda bulunuyor,Hurriyet.com.tr
other,son dakika msb duyurdu pkklı terörist etkisiz hale getirildi,milli savunma bakanlığından msb yapılan açıklamada irakın kuzeyindeki hakurk gara pençekilit operasyonu bölgelerinde tespit ettiği pkklı terörist suriyenin kuzeyindeki barış pınarı bölgesindeki pkkypgli terörist etkisiz hale getirildi,Hurriyet.com.tr
entertainment,son dakika dilan engin polat çiftinin tutuklandığı soruşturma tamamlandı,istanbul merkezli ilde düzenlenen operasyonun ardından dilan polat eşi engin polatın tutuklandığı soruşturma tamamlanarak iddianame hazırlandı soruşturma savcılığınca hazırlanan iddianamede şüphelilerin suçtan kaynaklanan mal varlığı değerlerini,Hurriyet.com.tr
politics,son dakika tbmmde temmuz töreni numan kurtulmuştan önemli açıklamalar,son dakika haberi tbmm başkanı numan kurtulmuş temmuz demokrasi millî birlik günü anma töreninde açıklamalarda bulundu kurtulmuş yaptığı açıklamada demokrasinin olmadığı yerde insan haklarının özgürlüklerin olması mümkün değildir demokrasi,Hurriyet.com.tr
other,son dakika msb duyurdu terörist etkisiz hale getirildi,milli savunma bakanlığından yapılan açıklamada suriyenin kuzeyindeki fırat kalkanı bölgesinde pkkypgli terörist pençekilit operasyonu bölgesinde pkklı teröristin etkisiz hale getirildiği bildirildi,Hurriyet.com.tr
other,son dakika manisada korkutan deprem çevre illerden hissedildi,afad manisanın soma ilçesinde büyüklüğünde deprem olduğunu duyurdu deprem bursa çanakkale izmir balıkesirden hissedildi deprem uzmanı prof dr şükrü ersoy cnn türk canlı yayınında somada meydana gelen depremi değerlendirdi prof ersoy,Hurriyet.com.tr
politics,son dakika cumhurbaşkanı yardımcısı cevdet yılmazdan cnn türkte önemli açıklamalar,cumhurbaşkanı yardımcısı cevdet yılmaz cnn türkte gece görüşü programında hürriyet gazetesi ankara temsilcisi hande fırat milliyet gazetesi yazarı zafer şahinin gündeme ilişkin sorularını yanıtlıyor,Hurriyet.com.tr
politics,son dakika bakan özhaseki sağlık sorunları nedeniyle görevinden affını istedi,çevre şehircilik iklim değişikliği bakanı mehmet özhaseki sağlık sorunları nedeniyle görevinden affını istediğini cumhurbaşkanı erdoğana ilettiğini duyurdu,Hurriyet.com.tr
politics,son dakika haberi yeni sağlık bakanı kemal memişoğlundan ilk açıklama,sağlık bakanı fahrettin koca görevden affını istedi kocanın yerine atanan kemal memişoğlu ilk açıklamasını yaptı bakan memişoğlu açıklamasında vatanımız milletimiz için onurlu göreve beni layık gördüğü için sayın cumhurbaşkanımıza şükranlarımı arz ed,Hurriyet.com.tr
politics,son dakika haberi bakan yerlikayadan kayseri paylaşımlarına ilişkin açıklama,kayseride meydana gelen olaylarla ilgili yeni açıklama yapan içişleri bakanı ali yerlikaya hesap ilgili soruşturma başlatıldığını belirtti,Hurriyet.com.tr
other,bakışı yasayı görüşen vekillere gönderiyorum,kereste fabrikasındaki yangın sönerken bursa itfaiyesinden görevli dumanların arasından gelen inleme duydu,Hurriyet.com.tr
politics,cumhurbaşkanı erdoğanın putin görüşmesi başladı,son dakika cumhurbaşkanı erdoğanın rus lider putin görüşmesi başladı,Haberturk.com
other,son dakika msb acı haberi duyurdu pençe kilitte asker şehit oldu,son dakika haberine göre milli savunma bakanlığı pençe kilit bölgesindeki saldırıda uzman çavuş cebrail acar şehit oldu terörist öldürüldü açıklamasını yaptı,Hurriyet.com.tr
other,yaş altında kanser vakaları hızla artıyor tanınmış onkolog kanser riskini azaltmak için uyguladığı dört kuralı anlattı,kanserin teşhis tedavisi adına son yıllarda atılan önemli adımlar hayatta kalma oranlarında kayda değer iyileşme sağladı madalyonun yüzüne baktığımızda özellikle yaş altı bireylerdeki vaka sayılarında yüzde lik artış olduğunu gör,Hurriyet.com.tr
politics,cumhurbaşkanı erdoğandan açıklamalar,son dakika cumhurbaşkanı erdoğan ak parti yerel yönetimler istişare değerlendirme toplantısında açıklamalarda bulunuyor,Haberturk.com
politics,bakan tunçtan kayseri olayları açıklaması,adalet bakanı yılmaz tunç dün akşam kayseride meydana gelen olayla ilgili son dakika açıklamalarda bulundu,Haberturk.com
other,tuzlada otluk alanda yangın,son dakika istanbul tuzlada ormanlık alanda yangın çıktı alevlere sayıda ekiple müdahale ediliyor,Haberturk.com
politics,cumhurbaşkanı erdoğandan pezeşkiyana telefon,son dakika cumhurbaşkanı erdoğan iranda cumhurbaşkanı seçilen pezeşkiyanı arayarak kutladı erdoğan mevkidaşına başarılar diledi,Haberturk.com
politics,yargı paketinde son durum,yargı paketi hakkındaki son durum gündemdekini yerini korumaya devam ediyor ceza indirimi son dakika gelişmeleri yakından takip edilirken vatandaşın gözü adalet bakanlığının yapacağı açıklamada peki yargı paketi zaman çıkacak maddeleri neler,Haberturk.com
other,erzurumda sel heyelan,son dakika haberi erzurumda yoğun yağış heyelan seli beraberinde getirdi ortaya korkutan görüntüler çıktı,Haberturk.com
politics,cumhurbaşkanı erdoğan abdde,son dakika haberi nato devlet hükümet başkanları zirvesine katılacak olan cumhurbaşkanı recep tayyip erdoğan heyetini taşıyan uçak washingtona indi,Hurriyet.com.tr
other,mevsim normallerinin derece üzerinde sıcak olacak,hava durumu son dakika meteorolojiden alınan son bilgilere göre bugün bölgemizde sağanak yağış bekleniyor sıcaklıklar ise mevsim normallerinin üzerinde seyrediyor illerimizde beklenen sıcaklıklar hava durumu,Haberturk.com
other,datça merkezde lik deprem,son dakika muğlanın datça ilçesinde saat te büyüklüğünde deprem meydana geldi depremin kilometre derinlikte meydana geldiği belirlendi,Haberturk.com
politics,suikast girişiminden saatler sonra görüntülendi,son dakika haberi abd başkan adayı donald trump suikast girişimine uğradıktan saatler sonra özel jetinden inerken görüldü,Haberturk.com
politics,sinan ateş davasında mütalaa açıklandı,son dakika gelişmesi sinan ateş davasında mütalaa açıklandı savcı sanığın beraatini istedi duruşma eylüle ertelendi,Haberturk.com
other,bingölde orman yangınları çıktı,son dakika bingölün genç kiğı ilçesinde orman yangını çıktı alevlere sayıda ekip tarafından müdahale ediliyor,Haberturk.com
other,son depremler listesi,afad kandilli son depremler listesi güncel olarak duyuruluyor irili ufaklı sarsıntıda dahil hisseden vatandaşlar önce deprem mi oldu nerede kaç büyüklüğünde sorusuna yanıt arıyor afad kandilli rasathanesi anlık olarak paylaşılıyor en son k,Haberturk.com
other,bodrumda orman yangını çıktı müdahale ediliyor,son dakika haberi muğlanın bodrum ilçesinde çıkan orman yangınına havadan karadan müdahale ediliyor yangınla ilgili inceleme başlatıldı,Haberturk.com
other,silivride otluk alanda yangın evlere sıçradı,son dakika haberler istanbul silivride otluk alanda yangın çıktı kısa sürede büyüyerek çevredeki bazı evlere sıçrayan yangına müdahale ediliyor,Haberturk.com
other,izmirde korku dolu anlar,son dakika haberler izmir gaziemirde ormanlık alanda yangın çıktı yerleşim yerlerine yakın alanda çıkan yangına müdahale ediliyor,Haberturk.com
other,parkta silahlı saldırı tutuklama,adanadan son dakika çatışma haberleri gelmeye devam ediyor parkta meydana gelen silahlı saldırıyla ilgili kişi tutuklandı,Haberturk.com
other,kahramanmaraşta deprem,son dakika deprem haberleri yakından takip ediliyor ülkemizin deprem riski altındaki bölgelerinde sıklıkla hissedilen son depremler afad kandilli rasathanesinin çalışmalarıyla anbean paylaşılıyor haziran pazar günü türkiyede meydana gele,Haberturk.com
other,yargı paketi son durum,yargı paketi son dakika gelişmeleri yakından takip ediliyor adalet bakanı yılmaz tunç yargı paketinin milletvekillerinin taslak üzerindeki değerlendirmelerinin tamamlanmasının ardından teklife dönüşeceğini bildirdi ceza indirimi denetimli serb,Haberturk.com
other,adanada fırtına vinç devrildi,son dakika faciadan dönüldü adanada şiddetli yağmur rüzgar ağaçları kökünden söktü inşaatta ise vinç devrildi,Haberturk.com
other,atatürk heykeline taşla saldırmıştı,son dakika haberler elazığda kent merkezinde bulunan atatürk heykeline taşla saldıran hk adliyeye sevk edildi şüphelinin adliyedeki işlemleri sürüyor,Haberturk.com
technology,türksat anın son ateşlemesi başarıyla gerçekleşti,türkiyenin ilk yerli milli haberleşme uydusu türksat anın yörünge yolculuğunda inci son ateşlemesi başarıyla gerçekleştirildi türksat anın yörünge yolculuğunda planlanan ateşlemelerin sona erdiğini belirten uraloğlu başlayan d,Haberturk.com
technology,son dakika türksat gece uzaya fırlatılıyor bakan uraloğlu cnn türkte anlattı,son dakika haber türksat gece abd spacex fırlatma merkezinden uzaya fırlatılacak ulaştırma altyapı bakanı abdulkadir uraloğlu cnn türkte konuya ilişkin açıklamalarda bulundu bakan uraloğlu yıllık serüvenden bahsediyoruz inşallah,Hurriyet.com.tr
politics,son dakika cumhurbaşkanı erdoğan ceza merihin şahsına türk milletine dönük verilmiştir,cumhurbaşkanı recep tayyip erdoğan uefanın euro ün son turunda oynanan avusturya maçındaki bozkurt hareketi nedeniyle milli futbolcu merih demirale verdiği cezayla ilgili uefanın verdiği ceza tamamen siyasi ceza merihin şahsına değildir as,Hurriyet.com.tr
entertainment,son dakika soğuk cüzdan detayı polat çiftine yönelik hazırlanan iddianamenin detayları ortaya çıktı,istanbul merkezli ilde düzenlenen operasyonun ardından dilan polat eşi engin polatın tutuklandığı soruşturma sonucunda hazırlanan iddianamenin detaylarına ulaşıldı iddianamede yasa dışı yollardan edinilen paraların soğuk cüzdan yöntemi siste,Hurriyet.com.tr
technology,son dakika bakan kacır cnn türke soruları yanıtlıyor uydu üretiminde ilk deyiz,son dakika haberi sanayi teknoloji bakanı mehmet fatih kacır cnn türk ekranlarında soruları yanıtlıyor uydu üretiminde ilk deyiz diyen bakan kacır türksat anın ateşleme sürecinin başladığını duyurdu öte yandan bakan kacır byd heyeti anlaş,Hurriyet.com.tr
other,son dakika kurye ata emre akmanı yerinden bıçaklayarak öldürmüştü cezası belli oldu,balıkesirde zincir restoranda kurye olarak çalışan üniversite öğrencisi ata emre akmanı yerinden bıçaklayarak öldüren erdoğan özdemire önce ağırlaştırılmış müebbet hapis cezası verildi sanık yaşında olduğu için cezası yıla düşürüldü aynı d,Hurriyet.com.tr
other,son dakika haberi izmirde orman yangını adnan menderes havalimanı uçak seferleri normale döndü,son dakika haberi izmirin gaziemir buca ilçeleri arasında çıkan orman yangınına müdahale sürüyor yangının adnan menderes havalimanına yakın konumda olması yükselen duman nedeniyle aksayan uçak seferleri normale döndü izmirin buca ilçesindeki orma,Hurriyet.com.tr
politics,son dakika haberi atama kararları resmi gazetede ilin valisi değişti,cumhurbaşkanlığı tarafından yapılan atamalar resmi gazetede yayımlandı diyarbakır valiliğine murat zoroğlu malatya valiliğine seddar yavuz atandı,Hurriyet.com.tr
politics,son dakika haberi dünyanın gözü abdde cumhurbaşkanı erdoğan nato zirvesine katılıyor,dünyanın gözü abdnin başkenti washingtonda düzenlenen nato zirvesinde cumhurbaşkanı erdoğanın katılım sağladığı nato zirvesinde liderler araya geldi,Hurriyet.com.tr
politics,son dakika cumhurbaşkanı erdoğandan abdde dönüşü önemli açıklamalar suriyede barış en bize fayda sağlayacak,son dakika haberi cumhurbaşkanı erdoğan abdde düzenlenen natonun kuruluş yıl dönümü törenleri dönüşü uçakta gazetecilerin gündeme ilişkin sorularını yanıtladı abdde yapılan f savaş uçağı anlaşmasına ilişkin soruyu yanıtlayan erdoğan bizim,Hurriyet.com.tr
politics,son dakika msb açıkladı irakın kuzeyine hava harekatı terör hedefi imha edildi,milli savunma bakanlığı irakın kuzeyine gerçekleştirilen hava harekatında terör hedefinin imha edildiğini duyurdu,Hurriyet.com.tr
other,kayıp olarak aranıyordu araçta ölü bulundular,son dakika elazığda yaşanan dehşette i kadın kişi otomobilde ölü bulundu olayda halil çetinin dün yakınlarının kayıp başvurusunda bulunduğu rukiye yıldırımı vurduktan sonra aynı silahla hayatına son verdiği şüphesi üzerinde duruluyor,Haberturk.com
other,rüzgar yağmur sıcak uyarısı,son dakika haberleri meteorolojiden yapılan son hava durumu tahminlerine göre doğu karadenizin iç kesimlerinde yağmur geçişleri görülürken marmarada poyraz etkili olacak hava sıcaklıkları karadenizde ila derece artarken bölgelerde önemli b,Haberturk.com
other,eylem tok oğlu böyle yakalandı,son dakika flaş görüntü istanbul eyüpsultanda ölümlü kaza sonrası abdye kaçan eylem tok oğlu timur cihantimurun gözaltına alınma görüntüleri ortaya çıktı,Haberturk.com
other,rizede sağanak sonrası sel,son dakika rizede şiddetli sağanak sele yol açtı kentin pazar ilçesinde yollar göle döndü karadeniz sahil yolunun bazı bölümlerinde su birikintileri meydana geldi,Haberturk.com
other,beton pompası kırıldı feci ölüm,son dakika haberleri mardinin merkez artuklu ilçesinde beton pompasının kırılan kolunun altında kalan işçi yaşındaki eşref k yaşamını yitirdi olayla ilgili soruşturma başlatıldı,Haberturk.com
politics,ilçede havai fişek kullanımı yasaklandı,son dakika haberi mersinin anamur ilçesinde düğün nişan özel günlerde havai fişek kullanımı yasaklandı gürültü kirliliği nedeniyle alınan karar oy birliğiyle kabul edildi,Haberturk.com
other,tatilciler dönüş yolunda,son dakika trafik durumu günlük kurban bayramı tatilinin sona ermesine saatler kala tatilciler dönüş yoluna geçti tekirdağistanbul yolunda uzun araç kuyrukları oluşmaya başladı,Haberturk.com
other,tekne battı facia yaşandı,son dakika konyada bulunan beyşehir gölünde tekne alabora oldu can pazarının yaşandığı anlarda kişi kurtuldu kişi ise hayatını kaybetti,Haberturk.com
other,evini taşlayan damadını öldürdü,son dakika istanbul esenlerde orhan d kapısına dayanan evini taşlayan damadı salih macata kurşun yağdırdı macat hayatını kaybederken şüpheli yakalanarak gözaltına alındı,Haberturk.com
other,arkadaşını taşla öldürdü,son dakika haberler elazığda tartıştığı arkadaşı yaşındaki yunus taşı başına taşla vurarak öldürdü olay sonrası kaçan yakalanıp gözaltına alındı denin emniyetteki işlemleri sürüyor,Haberturk.com
politics,nyt fotoğrafçısı kurşunu görüntüledi,son dakika abd başkan adayı trumpa yönelik suikast girişiminde dikkat çeken görüntü ortaya çıktı new york times fotoğrafçısı doug mills trumpın hemen yanından geçen kurşunu görüntülemeyi başardı,Haberturk.com
other,marinada feci kaza tekne bot çarpıştı denize düştü,son dakika haberi istanbulda marinada tekne botun çarpışması sonucu denize düşen yaşındaki selçuk mahanoğlunun cansız bedenine ulaşıldı mahanoğlunun cenazesi adli tıp kurumuna kaldırıldı soruşturma sürüyor,Haberturk.com
other,van gölünde facia can kayıpları var,son dakika haberi van gölünde tam facia yaşandı göle serinlemek için giren arkadaş kayboldu yapılan aramada müslüm ülgen serhat elçinin cansız bedenlerine ulaşıldı,Haberturk.com
politics,imamoğluna saldırı davasında karar,son dakika ibb başkanı imamoğluna erzurum mitinginde taşlı saldırıda bulundukları iddiasıyla yargılanan sanığa ay şar gün hapis cezası verildi,Haberturk.com
other,karabükte yol çöktü demiryolu ulaşıma kapandı,son dakika karabükte d kara yolunun metrelik kısmında çökme meydana geldi çöken bölgeden akan toprak nedeniyle karabük çankırı demir yolunu ulaşıma kapandı,Haberturk.com
other,yangın bölgesinde kuvvetli rüzgar sürüyor,son dakika meteorolojiden yapılan açıklamaya göre orman yangınlarının etkili olduğu izmirde kuvvetli rüzgar sürüyor rüzgarın hızının saatte kilometreye çıkabileceği belirtildi,Haberturk.com
other,orduda sağanak sonrası sel,son dakika ordunun fatsa ilçesinde sağanak sonrası sel meydana geldi ilçede evi su bastı sokaklar okulun bahçesi göle döndü,Haberturk.com
other,cezaevinde yangın kişi dumandan etkilendi,son dakika kocaelide kandıra nolu t tipi kapalı ceza infaz kurumunda yangın çıktı çamaşırhanede çıkan kısa sürede söndürülen yangında kişi dumandan etkilendi,Haberturk.com
other,tem otoyolunda zincirleme kaza yaralılar var,son dakika haberi tem otoyolu bahçeşehir mevkiinde sayıda aracın karıştığı zincirleme kaza meydana geldi olay yerine sayıda itfaiye sağlık polis ekibi sevk edildi,Haberturk.com
other,emekli polisten çifte cinayet baba oğlunu öldürdü,son dakika haberi çorumda arazi sulama kavgası dehşetle sonuçlandı olayda emekli polis memuru ahmet y tartıştığı kişiye ateş açtı olayda ramazan oğlu servet y hayatını kaybetti,Haberturk.com
other,suriye uyruklu ü çocuk kişiyi rehin aldılar,son dakika korkunç olay edirnede suriye uyruklu ü çocuk kişiyi silahla rehin alan saldırganlara operasyon düzenlendi kıskıvrak yakalanan zanlıların video çekerek göçmenlerin ailelerinden fidye istediği belirlendi,Haberturk.com
other,son dakika silivri mersin bingölde yangın sayıda ekip alevlere müdahale ediyor,istanbulda silivride anızdan çıkan yangın büyüdü alevler yerleşim bölgesine yaklaşıyor mersinin anamur ilçesinde evde çıkıp makilik zirai alana sıçrayan yangına havadan karadan müdahale ediliyor ayrıca balıkesirin altıeylül ilçesinde bi,Hurriyet.com.tr
other,son dakika haberi çevre şehircilik iklim değişikliği bakanı murat kurumdan ilk açıklama,çevre şehircilik iklim değişikliği bakanı mehmet özhaseki görevden affını istedi özhaseki yerine atanan murat kurum ilk açıklamasını yaptı bakan kurum açıklamasında bayrağı devralacağımız sayın mehmet özhaseki bakanımız gibi biz başta asrın felaketi,Hurriyet.com.tr
other,son dakika msb duyurdu irak suriyenin kuzeyinde terörist etkisiz hale getirildi,msbden yapılan açıklamada irakın kuzeyindeki pençe pençekilit operasyonu bölgelerinde tespit edilen pkklı terörist suriyenin kuzeyi zeytin dalı bölgelerindeki pkkypgli terörist türk silahlı kuvvetlerimiz tarafından etkisiz hale getiri,Hurriyet.com.tr
other,son dakika msbden açıklama pkklı teröristler köylerdeki mühimmat depolarını patlatıyor,milli savunma bakanlığından msb yapılan açıklamada pkklı teröristler dergele miska köylerindeki mühimmat depolarını havaya uçurdu köylülerin hayatını hiçe sayarak köy içindeki mühimmat depolarını patlatan teröristler dergele köyünü ise ta,Hurriyet.com.tr
other,son dakika süper lotoda büyük ikramiye sahibini buldu süper loto sonuç ekranı millipiyangoonlineda,süper lotoda tllik dev ikramiye sahibini buldu büyük ikramiyeyi kazandıran şanslı numaralar oldu,Hurriyet.com.tr
other,son dakika abddeki kritik davada karar timur cihantimurun tutukluk halinin devamına karar verildi,kemerburgazdaki kazada oğuz murat acinin ölümüne olan olaydan hemen sonra annesi eylem tokla yurtdışına kaçan timur cihantimur bugün abdde nci kez hâkim karşısına çıktı,Hurriyet.com.tr
